username,full_text,tweet_url
,berdasarkan pencarian terkini majelis ulama indonesia mui belum pernah menyampaikan kritik langsung terhadap isu rangkap jabatan di indonesia namun pada september 2025 mui menyatakan akan mengkaji permintaan fatwa mengenai halalharam penghasilan dari rangkap jabatan,https://x.com/undefined/status/1976362809668829645
,majelis ulama indonesia mui jawa tengah mendorong seluruh satuan pelayanan pemenuhan gizi sppg di provinsi ini segera mengantongi sertifikat halal,https://x.com/undefined/status/1976353271544779080
,majelis ulama indonesia semakin merah pd akhirnya semua ttg politik agama cuma alat cana an israelpalestina 900 th dijajah romawi 600 th dikontrol o kekhalifahan islam bgs israel akhirnya punya negara sndri setelah 1500 th dipaksa keluar dr tanahnya,https://x.com/undefined/status/1976192576589005140
,kukar dalam upaya mempererat sinergi antara kepolisian dan tokoh agama kapolres kutai kartanegara akbp khairul basyar melaksanakan kunjungan silaturahmi ke kantor majelis ulama indonesia mui kabupaten kutai kartanegara selasa 7102025 siang,https://x.com/undefined/status/1976189377215856746
,kapolres kukar bersilaturahmi dengan mui perkuat sinergi jaga kondusifitas dan harmoni umat dalam upaya mempererat sinergi antara kepolisian dan tokoh agama kapolres kutai kartanegara akbp khairul basyar melaksanakan kunjungan silaturahmi ke kantor majelis ulama indonesia,https://x.com/undefined/status/1976142834702090714
,majelis ulama indonesia mui menyerukan ke semua pihak buat menolak tim senam artistik israel yang dikabarkan bakal bertanding pada 1925 oktober 2025 di kejuaraan dunia senam artistik 2025 yang digelar di indonesia mui mendorong semua pihak buat mendukung pembebasan,https://x.com/undefined/status/1976139198882250992
,kutai barat polres kutai barat melalui sat binmas bersama majelis ulama indonesia mui kabupaten kutai barat menggelar sosialisasi pentingnya label halal pada produk pangan dan minuman kamis 9102025,https://x.com/undefined/status/1976118460641136729
,majelis ulama indonesia mui tegaskan dukungannya terhadap kemerdekaan palestina yang adil dan berdaulat siap mengawal proses perdamaian dan genjatan senjata melalui kerjasama dengan pemerintah indonesia,https://x.com/undefined/status/1975909132097007815
,sekjen majelis ulama indonesia mui amirsyah tambunan menyarankan kementerian agama kemenag membentuk direktorat jenderal pendidikan kepesantrenan hal itu disampaikan menyusul ambruknya gedung pondok pesantren ponpes al khoziny buduran sidoarjo beberapa waktu lalu,https://x.com/undefined/status/1975844866597773457
,majelis ulama indonesia mui meminta pemerintah indonesia bersikap tegas dan tidak mengizinkan kehadiran atlet israel dalam ajang kejuaraan dunia senam artistik 2025 di jakarta indonesia pada 1925 oktober 2025 hal itu diungkap langsung oleh ketua mui bidang hubungan luar,https://x.com/undefined/status/1975829767531163782
,majelis ulama indonesia mui resmi menyatakan penolakan terhadap rencana kedatangan atlet israel yang disebut akan berlaga padaworld artistic gymnastics championships 2025di jakarta pada19 25 oktober 2025 pernyataan ini disampaikan sekretaris jenderal mui amirsyah,https://x.com/undefined/status/1975814781065175385
,sekjen majelis ulama indonesia mui amirsyah tambunan menyarankan kementerian agama kemenag membentuk direktorat jenderal pendidikan kepesantrenan hal itu disampaikan menyusul ambruknya gedung pondok pesantren ponpes al khoziny buduran sidoarjo beberapa waktu lalu,https://x.com/undefined/status/1975742945002193179
,saatnya mengeluarkan pendapat dan sikap keagamaan majelis ulama indonesia,https://x.com/undefined/status/1975734242224316780
,ges kalau ada teman di majelis ulama indonesia tolong dibilangin kalau mau menghalangi lakukan di bandara itu urusan ditjen imigrasi mohon jangan sampai atlet israel masuk ke indonesia,https://x.com/undefined/status/1975730299477893137
,majelis ulama indonesia mui isinya,https://x.com/undefined/status/1975374153399390208
,mui majelis ulama intoleransi seharusnya katakan yang benar jika benar katakan salah jika salahdalam hal ini majelis ulama intoleransi sudah benar kecuali majelis ulama indonesia,https://x.com/undefined/status/1975018930629726608
,sejak kapan mui ngurusin kemenkeu bukannya fokus ngurus umat dan pesantren ketua majelis ulama indonesia mui bidang dakwah dan ukhuwah cholil nafis mengingatkan menteri keuangan menkeu purbaya yudhi sadewa untuk menjaga lisan saat berkomunikasi dengan masyarakat dia pun,https://x.com/undefined/status/1974883695309046163
,majelis ulama indonesia wkwk,https://x.com/undefined/status/1974847746441097246
,daftar sertifikasi halal lewat maybank syariah kini anda sebagai pengusaha bisa mengurus sertifikasi halal dengan lebih praktis melalui kerja sama antara maybank syariah dan lppom jakarta lembaga pengkajian pangan obatobatan dan kosmetika majelis ulama indonesia lakukan,https://x.com/undefined/status/1973998954154242117
,tanah grogot kamis 2 oktober 2025 kapolres paser melalui kasat binmas polres paser akp ramli menghadiri kegiatan rapat kerja daerah rakerda majelis ulama indonesia mui kabupaten paser yang berlangsung di gedung awa mangkuruku jl jend sudirman tanah grogot,https://x.com/undefined/status/1973646208460783645
,mui atau majelis ulama indonesia berdiri pada tanggal 26 juli 1975,https://x.com/undefined/status/1973616702350131597
,kabar duka datang dari majelis ulama indonesia mui ketua mui bidang ekonomi lukmanul hakim meninggal dunia,https://x.com/undefined/status/1973306442292850950
,ketua umum mui dki jakarta menerima kunjungan silaturahmi dpw abi dki jakarta jakarta 30 september 2025 ketua umum majelis ulama indonesia mui dki jakarta dr kh muhammad faiz syuron makmun menerima kunjungan silaturahmi dari ketua dewan pimpinan wilayah ahlulbait,https://x.com/undefined/status/1973246975362605175
,salam takziah kepada keluarga dr ir luqmanul hakim mantan pengarah lembaga pengkajian pangan obatobatan dan kosmetik majelis ulama indonesia lppom mui,https://x.com/undefined/status/1972998327529804021
,kalau dibuat di indonesia insyaallah halal kita husnudzan itu halal ucapnya namun untuk produk impor ia menegaskan perlunya kajian lebih mendalam guna memastikan kehalalannya ia mengingatkan bahwa di indonesia majelis ulama indonesia mui,https://x.com/undefined/status/1972985305591693585
,kabar duka datang dari majelis ulama indonesia mui ketua mui bidang ekonomi kh lukmanul hakim meninggal dunia,https://x.com/undefined/status/1972940226973807030
,detasemen khusus densus 88 antiteror polri menjadi pembicara dalam kegiatan mudzakaroh majelis ulama indonesia mui kabupaten cirebon m kegiatan ini bertujuan memperkuat peran ulama dalam mencegah penyebaran paham intoleransi radikalisme ekstremisme dan terorisme iret,https://x.com/undefined/status/1972907550069940666
,mui majelis ulama indonesia,https://x.com/undefined/status/1972664738837360826
,kapolsek cabangbungin akp alex chandra menghadiri kegiatan musyawarah daerah musda majelis ulama indonesia di aula kecamatan cabangbungin,https://x.com/undefined/status/1972574340089815274
,kapolsek cabangbungin akp alex chandra menghadiri kegiatan musyawarah daerah musda majelis ulama indonesia di aula kecamatan cabangbungin bekasikabupaten,https://x.com/undefined/status/1972572693787787760
,membangun kemitraan polres kutai barat jalin silaturahmi dengan ketua majelis ulama indonesia mui kutai barat untuk memperkuat kerja sama demi menjaga harkamtibmas di wilayah kutai barat,https://x.com/undefined/status/1972519324125700141
,majelis ulama indonesia,https://x.com/undefined/status/1971866892785844396
,kegiatan ini diinisiasi lembaga pengkajian pangan obatobatan dan kosmetika majelis ulama indonesia lppom mui bertema bergerak bersama dengan semangat halalan thayyiban duta halal akan menjadi motor pengerak literasi halal pendampingan dan mempercepat ekosistem halal,https://x.com/undefined/status/1971527534887215605
,wali kota administrasi jakarta pusat arifin membuka sosialisasi sertifikasi halal duta halal serta muzakarah ulama mui majelis ulama indonesia,https://x.com/undefined/status/1971527516352573922
,kapolres banjarbaru akbp pius x febry aceng loda sik mh menghadiri musyawarah daerah musda v majelis ulama indonesia kota banjarbaru masa khidmat 2025 2030 bertempat di aula gawi sabarataan pemko banjarbaru,https://x.com/undefined/status/1971239744282742892
,majelis ulama indonesia mui mengeluarkan fatwa pada 22 september 2025 meminta pemisahan jelas antara aktivisme kemanusiaan dan politik,https://x.com/undefined/status/1971047015397441686
,selasa 23 september 2025 anggota kpu kabupaten belitung timur menghadiri undangan seminar motivasi nasional yang diselenggarakan oleh majelis ulama indonesia mui kabupaten belitung timur dengan tema muda sukses bahagia masuk surga turut hadir,https://x.com/undefined/status/1970817199431712893
,jajaran pengurus majelis ulama indonesia mui provinsi banten melakukan audiensi ke gubernur banten andra soni di ruang kerja gubernur di kp3b kota serang senin 2292025 kemarin,https://x.com/undefined/status/1970461698726535324
,majelis ulama indonesia mui punya peran penting dalam pembinaan umat dan menjaga kerukunan beragama di banten karena itu pemprov banten mendukung penguatan kelembagaan mui dari tingkat provinsi hingga kecamatan dukungan ini sejalan dengan berbagai program pemerintah,https://x.com/undefined/status/1970388752846725397
,sore ini di fadli zon library saya menerima audiensi dari pengurus lembaga seni budaya dan peradaban islam lsbpi lsbpi adalah lembaga di bawah majelis ulama indonesia mui yang baru dibentuk pada kepengurusan mui 20202025 untuk mengelola mengkoordinasi dan,https://x.com/undefined/status/1970120336474792114
,ketua majelis permusyawaratan ulama aceh tgk h faisal ali menerima kunjungan silaturahmi dan audiensi kepala perwakilan bank indonesia provinsi aceh agus chusaini beserta jajaran pertemuan tersebut diadakan pada ruang kerja ketua mpu aceh senin 22092025,https://x.com/undefined/status/1970061273519042904
,majelis ulama indonesia mui telah menerbitkan fatwa no 83 tentang hukum dukungan terhadap perjuangan palestina,https://x.com/undefined/status/1970053242945192232
,majelis ulama indonesia mui jawa barat menyoroti dugaan ompreng program makan bergizi gratis mbg mengandung minyak babi yang ramai di publik,https://x.com/undefined/status/1970026372644155758
,ngopi yuk sambil bahas lebih lanjut soal tahlilan ada sumber dari majelis ulama indonesia yang bilang tradisi ini boleh selama tak bertentangan dengan syariat kamu punya pertanyaan spesifik lagi,https://x.com/undefined/status/1969695761182146717
,fatwa majelis ulama indonesia mui tentang boikot di indonesia pada 10 november 2023 majelis ulama indonesia mui mengeluarkan fatwa nomor 83 tahun 2023 tentang hukum dukungan terhadap perjuangan palestina,https://x.com/undefined/status/1969625330743984423
,ketua majelis wali amanat universitas indonesia mwa ui sekaligus ketua umum pengurus besar nahdatul ulama yahya cholil staquf menyampaikan permohonan maaf kepada sivitas akademika ui usai mengusulkan profesor pro z10n15t peter berkowitz untuk,https://x.com/undefined/status/1969494976066437471
,lengkapnya nanti jadi fatwa majelis ulama indonesia,https://x.com/undefined/status/1969458434425962934
,majelis ulama indonesia,https://x.com/undefined/status/1969340269322440793
,ilustrasi ktp elektronik ektpfoto republikaprayogi mui nilai ubah kolom agama penghayat kepercayaan di ktp berbahaya perubahan itu memberi kesan indonesia membolehkan penduduknya atheis jakarta ketua majelis ulama indonesia mui bidang,https://x.com/undefined/status/1969103943180394991
,majelis ulama indonesia mui dalam fatwa dsn no 772010 membolehkan jual beli emas secara tidak tunai hanya untuk investasi tapi tidak untuk transaksi yang bersifat pertukaran langsung seperti alat pembayaran,https://x.com/undefined/status/1968596992189194291
,rapat yang biasanya bisa sampai 3 jam dipangkas jadi 30 menit tidak ada sesi pendalaman hanya dengar paparan narasumber dari majelis ulama indonesia mui konferensi waligereja indonesia kwi dan koordinator komite nasional pengendalian tembakau,https://x.com/undefined/status/1968535660085600299
,penandatangan mou antara majelis ulama indonesia yang diwakili wakil ketua mui kh anwar abbas dengan grand mufti kazakhstan naurizbay haji taganuly bersamaan the 8th congress of leaders of world and traditional religions di astana kazakhstan pada 17 september 2025,https://x.com/undefined/status/1968512157110415415
,penandatangan mou antara majelis ulama indonesia yang diwakili wakil ketua mui kh anwar abbas dengan grand mufti kazakhstan naurizbay haji taganuly bersamaan the 8th congress of leaders of world and traditional religions di astana kazakhstan pada 17 september 2025,https://x.com/undefined/status/1968512094040625519
,kapolres boyolali akbp rosyid hartanto menjadi narasumber dalam forum group discussion majelis ulama indonesia mui kab boyolali dengan tema merajut kebersamaan dalam perbedaan,https://x.com/undefined/status/1968312776755159516
,humas polri kepala kepolisian daerah maluku utara irjen pol drs waris agono menerima silaturahmi dari imam besar masjid raya majelis ulama indonesia mui serta perwakilan majelis taklim di ruang kerjanya,https://x.com/undefined/status/1968272677812277424
,mahasiswa fakultas dirasat islamiyah uin syarif hidayatullah jakarta melaksanakan program magang di majelis ulama indonesia mui sebagai bagian dari kegiatan akademik dan pengembangan kompetensi selasa 16 september 2025,https://x.com/undefined/status/1968162141955035378
,poin menarik soal subjektivitas dalam islam prinsip ikhlas dan mencari kebenaran di atas keinginan pribadi dianjurkan untuk hindari bias mungkin coba bandingkan fatwa dari lembaga resmi seperti majelis ulama indonesia atau alazhar untuk perspektif lebih luas bagaimana cara,https://x.com/undefined/status/1968124933520904637
,jakarta ketua umum majelis ulama indonesia mui yang juga wakil rais aam pbnu kh anwar iskandar memberikan apresiasi kepada kapolri jenderal listyo sigit prabowo beserta jajaran kepolisian dan aparat keamanan atas langkah cepat mereka mengendalikan situasi pasca kericuhan,https://x.com/undefined/status/1967403874152816670
,ketum mui puji polri cepat pulihkan kondisi pasca kericuhan alhamdulillah kehidupan kini normal kembali jakarta ketua umum majelis ulama indonesia mui yang juga wakil rais aam pbnu kh anwar iskandar memberikan apresiasi kepada kapolri jenderal listyo sigit prabowo,https://x.com/undefined/status/1967224257517437237
,ustad bachtiar nasir lc mm pimpinan aql arrahman qur anic learning center amp sekjen majelis intelektual amp ulama muda indonesia dr fahmi salim zubair lc ma founder al fahmu institute amp ketua baitul maqdis institute direktorat diplomasi publik,https://x.com/undefined/status/1967210589052444959
,ketum mui puji polri cepat pulihkan kondisi pasca kericuhan alhamdulillah kehidupan kini normal kembali jakarta ketua umum majelis ulama indonesia mui yang juga wakil rais aam pbnu kh anwar iskandar memberikan apresiasi kepada kapolri jenderal listyo sigit prabowo,https://x.com/undefined/status/1967204162292285901
,ketum mui puji polri cepat pulihkan kondisi pasca kericuhan alhamdulillah kehidupan kini normal kembali jakarta ketua umum majelis ulama indonesia mui yang juga wakil rais aam pbnu kh anwar iskandar memberikan apresiasi kepada kapolri jenderal listyo sigit prabowo,https://x.com/undefined/status/1967194039859790115
,ketum mui puji polri cepat pulihkan kondisi pasca kericuhan alhamdulillah kehidupan kini normal kembali jakarta ketua umum majelis ulama indonesia mui yang juga wakil rais aam pbnu kh anwar iskandar memberikan apresiasi kepada kapolri jenderal listyo sigit prabowo,https://x.com/undefined/status/1967190270212186330
,ketum mui puji polri cepat pulihkan kondisi pasca kericuhan alhamdulillah kehidupan kini normal kembali jakarta ketua umum majelis ulama indonesia mui yang juga wakil rais aam pbnu kh anwar iskandar memberikan apresiasi kepada kapolri,https://x.com/undefined/status/1967131097428619478
,bappeda update pemerintah kabupaten tangerang bersama majelis ulama indonesia mui kabupaten tangerang dan forkopimda menggelar peringatan maulid nabi muhammad saw 1447 h pada kamis 1192025,https://x.com/undefined/status/1966103893152305592
,center of economic and law studies celios kirimkan surat kepada komisi fatwa majelis ulama indonesia mui,https://x.com/undefined/status/1966064184883294482
,majelis ulama indonesia mui merespons permintaan center of economic and law studies celios agar lembaga fatwa tertinggi umat islam di indonesia mengeluarkan pandangan hukum terkait menteri maupun wakil menteri yang merangkap jabatan sebagai komisaris di bumn ketua mui,https://x.com/undefined/status/1966014044420321696
,purworejo humas musyawarah daerah musda x majelis ulama indonesia mui kabupaten purworejo tahun 2025 kegiatan yang mengusung tema mewujudkan masyarakat yang berkualitas khaira ummah menuju kabupaten purworejo yang aman damai adil dan makmur diridhai allah swt,https://x.com/undefined/status/1965334138338332973
,pelda suparman dan serda bahtiar hadiri pelantikan pengurus mui balocci dan sosialisasi fatwa sobis pelda suparman batuud ramil 142101balocci bersama serda bahtiar babinsa kelurahan balleangin menghadiri acara pelantikan pengurus dewan pimpinan majelis ulama indonesia,https://x.com/undefined/status/1965225140763214308
,ijtima ulama amp umara majelis ulama indonesia mui lampung hotel horison 08092025,https://x.com/undefined/status/1965216028272865714
,kok udah gak majelis ulama indonesia,https://x.com/undefined/status/1964866233968497053
,majelis ulama indonesia mui menyoroti pasukan israel yang menangkap wali kota hebron tayseer abu sneineh tayseer ditangkap pada selasa 29 tidak hanya menangkap walkot hebron pasukan israel yang merusak rumahnya ketua mui bidang hubungan luar negeri dan kerja sama,https://x.com/undefined/status/1964184284903985201
,kapolres ngawi akbp charles pandapotan tampubolon sik sh mh didampingi pejabat utama polres ngawi menerima kunjungan silaturahmi wakil bupati ngawi dan ketua majelis ulama indonesia mui kabupaten ngawi bersama rombongan di ruang guyup polres ngawi rabu 392025,https://x.com/undefined/status/1963415547716198710
,kapolres ngawi menerima kunjungan silaturahmi wakil bupati ngawi dr dwi rianto jatmiko dan ketua majelis ulama indonesia mui kabupaten ngawi kh halil thahir bersama rombongan di ruang guyup polres ngawi rabu 392025,https://x.com/undefined/status/1963414711258812761
,kapolres ngawi akbp charles pandapotan tampubolon sik sh mh didampingi pejabat utama polres ngawi menerima kunjungan silaturahmi wakil bupati ngawi dr dwi rianto jatmiko dan ketua majelis ulama indonesia mui kabupaten ngawi kh halil thahir bersama rombongan,https://x.com/undefined/status/1963399334302773447
,ahlan wa sahlan al allamah alhabib umar bin hafizh di indonesia solo 1113 oktober 2025 jakarta 1720 oktober 2025 majelis almuwasholah baina ulama almuslimin,https://x.com/undefined/status/1963202035651883166
,di balik setiap senyuman anak palestina ada harapan yang terus hidup dan di balik harapan itu ada kita yang peduli melalui zakat yang kita titipkan majelis ulama indonesia mui sudah menetapkan zakat boleh disalurkan ke palestina,https://x.com/undefined/status/1963179837964591361
,kapolres ngawi akbp charles pandapotan tampubolon sik sh mh didampingi pejabat utama polres ngawi menerima kunjungan silaturahmi wakil bupati ngawi dr dwi rianto jatmiko dan ketua majelis ulama indonesia mui kabupaten ngawi kh halil thahir bersama rombongan,https://x.com/undefined/status/1963171822813491380
,ketua majelis ulama indonesia mui kab kutai barat,https://x.com/undefined/status/1963081661689823741
,romo suhadi sebagai ketua konferensi waligereja indonesia kwi kh mashudi sebagai wakil ketua umum majelis ulama indonesia mui dan eko sriyanto galgendu sebagai wali spiritual nusantara simak selengkapnya dalam video berikut penulis siti laela malhikmah video,https://x.com/undefined/status/1963058593982513384
,dharma indonesia phdi prof dr yusnar yusuf rangkuti sebagai ketua majelis ulama indonesia mui philip k widjaja sebagai ketua umum perwakilan umat buddha indonesia permabudhi budi santoso tanuwibowo sebagai ketua umum majelis tinggi agama khonghucu indonesia matakin,https://x.com/undefined/status/1963058503469433229
,majelis ulama indonesia mui kota bengkulu mengajak seluruh pihak untuk samasama menjaga situasi kondusif provinsi bengkulu yang berjuluk bumi merah putih tersebut dengan menyalurkan aspirasi secara damai dan bijak,https://x.com/undefined/status/1962872301936099506
,ketua umum majelis ulama indonesia mui kiai anwar iskandar mengingatkan pentingnya kerukunan untuk menjaga stabilitas yang diperlukan bagi negara klik untuk baca,https://x.com/undefined/status/1962838617044459942
,pernyataan sikap bersama majelis ulama indonesia mui bersama tokoh lintas agama di kabupaten probolinggo menyatakan komitmen menjaga kerukunan kedamaian dan menolak segala bentuk provokasi yang dapat memecah belah bangsa,https://x.com/undefined/status/1962813274719997987
,pernyataan sikap bersama majelis ulama indonesia mui bersama tokoh lintas agama di kabupaten probolinggo menyatakan komitmen menjaga kerukunan kedamaian dan menolak segala bentuk provokasi,https://x.com/undefined/status/1962791547604533569
,btn resmi meluncurkan program pembiayaan rumah subsidi berbasis syariah bagi da i guru ngaji aktivis islam dan pegawai ormas islam di lingkungan majelis ulama indonesia mui ampgurungajipunyarumahkarnabtn,https://x.com/undefined/status/1962777653959893450
,gresiksatu majelis ulama indonesia mui kabupaten gresik melalui komisi ukhwah dan hubungan antar lembaga menggelar pertemuan dengan tema merawat ukhwah merajut kebersamaan agar gresik tetap kondusif acara ini berlangsung di kantor mui gresik,https://x.com/undefined/status/1962762970666279227
,kukar kapolres kutai kartanegara akbp khairul basyar menghadiri kegiatan rapat kerja dan penyerahan dana operasional mui kecamatan dan komisikomisi tahun 2025 yang digelar oleh majelis ulama indonesia mui kabupaten kutai kartanegara pada minggu 31 agustus 2025,https://x.com/undefined/status/1962687191555133586
,kapolsek loa kulu jalin silaturahmi dengan ketua mui perkuat sinergi ciptakan kamtibmas kondusif kukar dalam rangka mempererat hubungan silaturahmi dengan tokoh agama kapolsek loa kulu akp hari supranoto melaksanakan kunjungan ke kediaman ketua majelis ulama indonesia mui,https://x.com/undefined/status/1962432104761069918
,kukar dalam rangka mempererat hubungan silaturahmi dengan tokoh agama kapolsek loa kulu akp hari supranoto melaksanakan kunjungan ke kediaman ketua majelis ulama indonesia mui kecamatan loa kulu raisul anam pada jumat 2982025 siang,https://x.com/undefined/status/1962423207094591921
,btn resmi meluncurkan program pembiayaan rumah subsidi berbasis syariah bagi da i guru ngaji aktivis islam dan pegawai ormas islam di lingkungan majelis ulama indonesia mui,https://x.com/undefined/status/1962411229101928902
,11 ampgurungajipunyarumahkarnabtn btn resmi meluncurkan program pembiayaan rumah subsidi berbasis syariah bagi da i guru ngaji aktivis islam dan pegawai ormas islam di lingkungan majelis ulama indonesia mui program ini merupakan kolaborasi antara pemerintah btn tapera,https://x.com/undefined/status/1962365938466263320
,kapolsek loa kulu jalin silaturahmi dengan ketua mui perkuat sinergi ciptakan kamtibmas kondusif kukar dalam rangka mempererat hubungan silaturahmi dengan tokoh agama kapolsek loa kulu akp hari supranoto melaksanakan kunjungan ke kediaman ketua majelis ulama indonesia mui,https://x.com/undefined/status/1962354945321250886
,pengurus wilayah nahdlatul ulama pwnu lampung dan majelis ulama indonesia mui lampung menyeruhkan perdamaian dalam menyikapi dinamika aksi massa yang banyak terjadi bekalangan ini,https://x.com/undefined/status/1962346344506601548
,kukar kapolres kutai kartanegara akbp khairul basyar menghadiri kegiatan rapat kerja dan penyerahan dana operasional mui kecamatan dan komisikomisi tahun 2025 yang digelar oleh majelis ulama indonesia mui kabupaten kutai kartanegara pada minggu 31 agustus 2025,https://x.com/undefined/status/1962344117717061793
,para pemuka agama mengimbau warga yang berdemonstrasi agar menghentikan aksi penjarahan ketua majelis ulama indonesia mui bidang fatwa kh asrorun niam sholeh mengatakan aksi penjarahan harus dihentikan karena melanggar hukum,https://x.com/undefined/status/1962292105461809249
,btn resmi meluncurkan program pembiayaan rumah subsidi berbasis syariah bagi da i guru ngaji aktivis islam dan pegawai ormas islam di lingkungan majelis ulama indonesia mui ampgurungajipunyarumahkarnabtn,https://x.com/undefined/status/1962140918703927583
,majelis ulama indonesia mui meminta semua pihak berkomitmen mewujudkan kedamaian serta menegaskan penjarahan merupakan perbuatan tercela yang melanggar hukum dan bertentangan dengan ajaran agama sumber cnn indonesia,https://x.com/undefined/status/1962114105034355085
,ketua majelis ulama indonesia mui kota cimahi bpk kh alan nur ridwan menghimbau kepada seluruh elemen masyarakat kota cimahi untuk bersamasama menjaga kondusifitas di kota cimahi,https://x.com/undefined/status/1962112117362008167
,mui majelis ulama indonesia mui majelis ulama indonesia,https://x.com/undefined/status/1962068551445147805
,mui majelis ulama indonesia mui majelis ulama indonesia,https://x.com/undefined/status/1962068438484127911
,ketua majelis ulama indonesia mui asrorun niam mengajak semua pejabat institusi dan lembaga pemerintah hentikan korupsi kolusi dan nepotisme karena itu penyebab terjadinya penjarahan serta perusakan terhadap fasilitas publik kalo gini masyarakat pasti mau dukung,https://x.com/undefined/status/1962062560406155295
