username,full_text,tweet_url
,apakah jeune fen black opium collagen body lotion sudah bpom dan halal,https://x.com/undefined/status/1995844187397501271
,apakah kojiesan whitening body lotion with kojic acid sudah bpom dan halal,https://x.com/undefined/status/1995842989856620671
,apakah scarlett fragrance body lotion jolly sudah bpom dan halal,https://x.com/undefined/status/1995841942538911823
,apakah kojiesan skin brightening soap with kojic dipalmitate vitamin a c amp e sudah bpom dan halal,https://x.com/undefined/status/1995840608372752646
,apakah deviti body lotion sudah bpom dan halal,https://x.com/undefined/status/1995837965864763670
,dengan adanya sertifikasi halal pada produk berarti sudah terjamin bahwa produk tersebut aman dan sehat untuk dikonsumsi dan kami sebagai konsumen tidak ragu lagi tentang kehalalan produk yang sudah bersertifikat halal,https://x.com/undefined/status/1995818027313758642
,betul sekali dengan adanya sertifikasi halal pada sebuah produk berarti sudah ada jaminan bahwa produk tersebut aman dan sehat untuk dikonsumsi,https://x.com/undefined/status/1995816369821216921
,produk perikanan dan olahannya juga termasuk dalam kategori yang wajib memiliki perizinan halal untuk memudahkan proses pendaftaran pastikan anda memilih pendamping proses produk halal pph yang telah ditetapkan,https://x.com/undefined/status/1995789045147074680
,seluruh produk yang beredar dan diperdagangkan di indonesia wajib memiliki sertifikat halal ketentuan ini berlaku untuk berbagai jenis produk seperti makanan minuman bahan baku jasa penyembelihan serta hasil sembelihan,https://x.com/undefined/status/1995789017846349931
,salam super sahabat ayo segera daftarkan produk olahan perikanan poklahsar anda untuk memperoleh perizinan halal tahukah anda sesuai uu no 11 tahun 2020 dan pp no 39 tahun 2021,https://x.com/undefined/status/1995789015459725720
,buat jadi produk pionir yang meroket tahun depan pt skinsol bionature asia siap bantu kamu dari riset formulasi legalitas sampe produksi tinggal bawa visi sisanya biar kami yang urus skinsol bionature asia pabrik herbal terbaik dan terbesar bpom halal,https://x.com/undefined/status/1995784492200722549
,apakah viva special day cream sudah bpom dan halal,https://x.com/undefined/status/1995776255363559873
,apakah bioaqua nenhong pink gentle gel sudah bpom dan halal,https://x.com/undefined/status/1995774974662267073
,apakah zusa jes brightening transparent soap sudah bpom dan halal,https://x.com/undefined/status/1995772510282121597
,apakah l oreal elseve hyaluron moisture hydra filling night cream leave in sudah bpom dan halal,https://x.com/undefined/status/1995771278352154718
,apakah dr oky pratama home peeling sudah bpom dan halal,https://x.com/undefined/status/1995769885830328564
,apakah ms glow luminous glowing serum sudah bpom dan halal,https://x.com/undefined/status/1995768675027263687
,apakah hamph skin sunscreen lightening pink sudah bpom dan halal,https://x.com/undefined/status/1995767538136019178
,apakah marcks bedak beauty powder creme sudah bpom dan halal,https://x.com/undefined/status/1995766297028858084
,apakah rk glow beauty lotion sudah bpom dan halal,https://x.com/undefined/status/1995765023994773583
,apakah clorismen soap sudah bpom dan halal,https://x.com/undefined/status/1995762512243945755
,apakah evangeline eau de parfum natural spray vaporisateur black sakura sudah bpom dan halal,https://x.com/undefined/status/1995761197120192882
,kue lapis legit kismis 17x17cm lapis legit asli basah makanan enak murah halal harga produk rp85000 harga diskon rp39500,https://x.com/undefined/status/1995318852692140346
,dodol wijen khas tangerang fresh manis lembek 250 gr 1 pcs halal harga produk rp23000 harga diskon rp16900,https://x.com/undefined/status/1995316612208234618
,kue nagasaki 151 gratis ice skin mooncake halal lembut creamy manis segar camilan kekinian premium camilan sehat anak amp dewasa bisa cod oleholeh hadiah snack harian camilan keluarga harga produk rp73000 harga diskon rp36500,https://x.com/undefined/status/1995316148343296051
,dodol durian asli khas tangerang 200 gr harum manis halal harga produk rp29000 harga diskon rp17900,https://x.com/undefined/status/1995315622461472954
,produk yg kami tawarkan produk kualitas premiumdi jamin halal dan milik muslim lokal ayo kita belajar cinta dengan produk anak negeri seharusnya kita bangga dengan produk anak negeri cek produk klik di sini,https://x.com/undefined/status/1995300105948483684
,lol semua link yang dikasih pasti ada kayak gitunya itu menandakan pada jaman sekarang babi itu terlepas halal dan haramnya karena balik lagi ke indivdu masingmasing relatif aman dikonsumsi asal pengolahannya bener sama aja kayak produk daging lainnya gitu kan,https://x.com/undefined/status/1995276221173907553
,tiktokshop diskon 2025 sd 75rb klaim vouchernya disini rekomendasi produk snack lainnya cek toko kopi gajah 1dus beanbag produk lain cek toko,https://x.com/undefined/status/1995191105537909209
,sebagai bagian dari danone indonesia aqua telah hadir lebih dari 50 tahun memproduksi secara lokal di 20 pabrik melibatkan 10500 karyawan dan bekerja sama dengan 2 juta mitra di seluruh indonesia semua produk kami aman sesuai standar bpom amp sni serta tersertifikasi halal,https://x.com/undefined/status/1995149222669140431
,kalo di pikir kak jin hebat bange jd ba amp mie ramen yg awalnya g ada produk halal skrng jd ada trus yg ikan kemasan jg ntah dr awal sudah halalblm tp skrng lebih yakin karna udah ada tulisannya mana produk,https://x.com/undefined/status/1995142602526707946
,apakah garnier skin naturals sakura glow hyaluron serum cream uv sudah bpom dan halal,https://x.com/undefined/status/1995142241103601896
,apakah emina bright stuff moisturizing cream sudah bpom dan halal,https://x.com/undefined/status/1995140880953680134
,apakah maybelline super stay vinyl ink 10 lippy sudah bpom dan halal,https://x.com/undefined/status/1995139506283188679
,apakah cosrx salicylic acid daily gentle cleanser sudah bpom dan halal,https://x.com/undefined/status/1995138308108865651
,apakah cosrx advanced snail 96 mucin power essence sudah bpom dan halal,https://x.com/undefined/status/1995137082373935108
,apakah wardah perfect bright bright tone up micellar water sudah bpom dan halal,https://x.com/undefined/status/1995135827584905262
,apakah luxcrime blur amp cover two way cake buttercream sudah bpom dan halal,https://x.com/undefined/status/1995134611404578931
,apakah wardah crystal secret foaming cleanser sudah bpom dan halal,https://x.com/undefined/status/1995133340975034668
,apakah bening s by dr oky pratama dipl aaam brightening night cream sudah bpom dan halal,https://x.com/undefined/status/1995131881466249248
,apakah nivea extra bright campe vitamin lotion sudah bpom dan halal,https://x.com/undefined/status/1995130776736973195
,apakah kanna beauty care brightening and hydrating red jelly fresh glow sudah bpom dan halal,https://x.com/undefined/status/1995129499369836934
,apakah sea make up acne clear micellar water sudah bpom dan halal,https://x.com/undefined/status/1995128324696191263
,apakah ms cosmetic watermelon hydrating juice sudah bpom dan halal,https://x.com/undefined/status/1995125775498981575
,apakah camille green tea wash off mask with niacinamide sudah bpom dan halal,https://x.com/undefined/status/1995124408843681829
,apakah herbal plus lightening cream daily use sudah bpom dan halal,https://x.com/undefined/status/1995123256743866865
,apakah pyary nalpamara herbal soap sudah bpom dan halal,https://x.com/undefined/status/1995121753719279907
,apakah hamph skin sunscreen acne sudah bpom dan halal,https://x.com/undefined/status/1995120640039514395
,apakah adera collagen soap sudah bpom dan halal,https://x.com/undefined/status/1995119485809012847
,apakah seca skin renewal mild exfoliating gel sudah bpom dan halal,https://x.com/undefined/status/1995116935592530112
,apakah adera sisty breast gel with pueraria mirifica extract sudah bpom dan halal,https://x.com/undefined/status/1995115793273487501
,apakah jill skincare acne spot gel sudah bpom dan halal,https://x.com/undefined/status/1995114401591185697
,apakah angel tacik whitening body lotion biru muda sudah bpom dan halal,https://x.com/undefined/status/1995113280923177314
,apakah bg skin premium night cream with kojic acid sudah bpom dan halal,https://x.com/undefined/status/1995111982781849616
,apakah my skoonheid whitening body lotion sudah bpom dan halal,https://x.com/undefined/status/1995108664538189955
,apakah maybelline super stay vinyl ink 15 peachy sudah bpom dan halal,https://x.com/undefined/status/1995106864904962209
,apakah flowhite bright essence body serum sudah bpom dan halal,https://x.com/undefined/status/1995105648477122792
,apakah glumevit tone up booster sudah bpom dan halal,https://x.com/undefined/status/1995104398163444203
,sertifikasi halal itu kunci penting untuk produk umk agar makin dipercaya dan mudah diterima di pasar internasional,https://x.com/undefined/status/1995092789651263623
,keren banget usaha lokal bisa tembus pasar luar negeri sertifikat halal emang jadi nilai plus besar buat produk seperti ini,https://x.com/undefined/status/1995092638756934121
,wah keren banget lihat umk seperti asia bisa menembus pasar luar negeri sertifikat halal memang jadi kunci penting biar produk makin dipercaya dan mudah diterima di banyak negara semoga makin banyak pelaku usaha yang sadar pentingnya halal dan ikut maju bareng mantap,https://x.com/undefined/status/1995092461757313376
,masyaallah inspiratif sekali sertifikat halal memang jadi kunci penting buat umkm bisa melangkah lebih jauh sampai ke pasar internasional semoga semakin banyak produk lokal yang go global,https://x.com/undefined/status/1995091909430432096
,dengan halal produk umk makin dipercaya makin mudah lolos persyaratan negara tujuan dan makin siap terbang jauh lebih tinggi yuk mulai urus sertifikat halalnya dari sekarang,https://x.com/undefined/status/1995086702722093391
,hoaks produk nonhalal akan dianggap ilegal per 2026,https://x.com/undefined/status/1995075888678047948
,kolaborasi bersama universitas tazkia kembangkan program riset produk halal dorong daya saing industri nasional,https://x.com/undefined/status/1994993434244125155
,bpjph betul2 kerja nyata dan berul2 buat kita tidak ragu lg dg produk halal,https://x.com/undefined/status/1994970898554917330
,upaya bersama ini bukan hanya menghadirkan produk dan layanan yang memenuhi kaidah halal tetapi juga memperkuat kepercayaan konsumen dan membuka peluang ekonomi baru di berbagai sektor,https://x.com/undefined/status/1994970892737429693
,dengan layanan yang semakin efektif kolaborasi lintas instansi yang solid serta edukasi berkelanjutan untuk para pelaku usaha bpjph dapat menjadi motor penggerak utama dalam memperluas jangkauan produk halal indonesia,https://x.com/undefined/status/1994970132012306692
,upaya bersama ini bukan hanya menghadirkan produk dan layanan yang memenuhi kaidah halal tetapi juga memperkuat kepercayaan konsumen dan membuka peluang ekonomi baru di berbagai sektor,https://x.com/undefined/status/1994969561234628963
,bpjph merangkul semua dari regulator hingga pelaku usaha demi jaminan produk halal yang kredibel,https://x.com/undefined/status/1994968276842287530
,optimis dengan langkah dengan perguruan tinggi bisa menjadikan indonesia jadi pemain besar pemasok produk halal dunia,https://x.com/undefined/status/1994966993250971917
,bpjph dan perguruan tinggi kolaborasi nyata untuk memperkuat standar dan kualitas produk halal,https://x.com/undefined/status/1994966671057195252
,dengan dukungan lintas lembaga lewat memperkuat ekosistem produk halal di indonesia loh,https://x.com/undefined/status/1994965449885569395
,bersama bpjph kita wujudkan produk halal indonesia yang mendunia,https://x.com/undefined/status/1994965253894054123
,dari sosialisasi sampai pendampingan kerja bareng bpjph menunjukkan komitmen untuk mengamankan produk halal di indonesia sinergi yang bukan cuma teori tapi aksi nyata,https://x.com/undefined/status/1994964874649354533
,sangat menjadi pelengkap membawa kepercayaan global pada produk halal indonesia,https://x.com/undefined/status/1994964180215239119
,dengan sertifikasi halal produk anda makin dipercaya,https://x.com/undefined/status/1994963867378880746
,terima kasih bpjph atas upaya memastikan produk halal dan aman semangat terus memberikan pelayanan terbaik untuk masyarakat,https://x.com/undefined/status/1994963827214229530
,bpjph garda terdepan jaminan produk halal di indonesia,https://x.com/undefined/status/1994963735845486675
,kalo begini mah indonesia makin maju support terus utk produk halal bisa dijadikan prinsip hidup masyarakat,https://x.com/undefined/status/1994963572703859161
,membangun ekosistem halal butuh kerja bersama dukungan bpjph memperkuat standar kepastian dan kepercayaan masyarakat terhadap produk halal,https://x.com/undefined/status/1994963565195980862
,kade ah ujug2 dibere spanduk di sini hanya ada produk haram,https://x.com/undefined/status/1995982569104674905
,kalo musik haram ya market musik bukan ke muslim blok kalo peminat produk kecil ya tinggal naikin value lu naikin harga jadi noh musik barang mewah otak dipake cil,https://x.com/undefined/status/1995971288175968303
,produk si haram,https://x.com/undefined/status/1995841161542644081
,makanya dibaca brocacho alat modern itu sdh termasuk metode pengolahan yg tergolong konvensional tau ya artinya semua daging ada resiko parasit nentuin pure bersihnya itu tergantung gimana produk itu dihandle halal haram itu lain lagi ga ada urusannya sma cacing pita,https://x.com/undefined/status/1995736825898356934
,ya udah resiko kalau nggak laku di pasar bebas itu boleh di islam lu mau ambil keuntungan 100 asal transparan tanpa adanya paksaan tanpa ada kedzaliman bukan barang haramdiperoleh secara haram itu bolehhalal di indonesia asal bukan produk yg nggak ada penetapan,https://x.com/undefined/status/1995627037609132315
,bayangin menggantungkan status halal dan haram pada produk hukum manusia nikah siri haram klo nikah siri di eropa atau amerika halal atau haram islam itu rahmat sekalian alam bukan cuma indon doang,https://x.com/undefined/status/1995375064573944169
,semua produk hewani even nabati terlepas halal atau haramnya kalo kena kontaminasi pasti mengandung parasit kalo orangnya itu faham hal fundamental kayak gini mah harusnya ngerti haram karena syariat itu satu hal tapi kalo dibalut cocoklogi ya ngapain,https://x.com/undefined/status/1994332764863385646
,2 apa jaminan industri kepada pengguna bahawa produk mereka yang ada sekarang tawarruq commodity murabaha aitab etc tidak mengikut jejak langkah bay alinah yang diputuskan sebagai haram apa jaminan mereka tak mengulangi kesilapan lampau,https://x.com/undefined/status/1994319212417044915
,suap jelas haram dalam islam misalnya qs annisa 429 jika suap mengakibatkan sertifikasi palsu atau proses tak sesuai syariat maka status halal produk bisa diragukan atau batal namun jika produk secara intrinsik halal bahan amp proses benar suap di pihak sertifikator tak,https://x.com/undefined/status/1994068190134194408
,tapi kan di fatwa mui ga boleh ada penamaan produk yg menjurus ke produk yg haram walaupun cuma perisa atau penambah rasa aja,https://x.com/undefined/status/1993284713851883672
,tambang illegal amp legal seperti sekeping uang logam dgn 2 sisi contoh kasus pttimah dgn penambang2 illegal tak mungkin yg illegal bisa ditertibkan tanpa pengawasan yg ketat pd yg legal yg illegal menjual produknya kpd yg legal produk haram jdi halal sama2 cuan,https://x.com/undefined/status/1993205616672903534
,si trainer memberiku penjelasan tentang tipetipe pertanyaan dan bagaimana cara menggunakannya untuk mendapatkan informasi berharga sebelum itu haram hukumnya untuk menjelaskan tentang produk haram,https://x.com/undefined/status/1993184133967987146
,produk yang pada asalnya halal lalu kita boikot karena suatu hal bukan berarti zatnya jadi haram dikasih ya terima aja boleh mengedukasi tapi gausah ghuluw lah,https://x.com/undefined/status/1992564232416833585
,tapi ye lah ulama terdahulu tak dibayar oleh bank tak bekerja terikat dengan regulator takde kpi meluluskan produk tak perlu jaga profitability atau kehendak institusi mereka bebas berkata ini helah riba haram walaupun nampak akad jual beli,https://x.com/undefined/status/1992237852059652428
,berdasarkan sk direktur lppom mui sk46dirlppom muixii14 dan fatwa mui no 4 tahun 2003 terdapat kriteria sistem jaminan halal sjh terkait penamaan produk 1 nama tidak boleh menggunakan nama minuman kerasharam contoh root beer rhum wine meskipun tidak beralkohol,https://x.com/undefined/status/1991748975372955682
,yang dibutuhkan masyarakat sertifikat haram jadi bisa tahu ini produk non halal,https://x.com/undefined/status/1991640045141520889
,bang jangan alih tiang gol sekarang kalau gabung akad salah dan haram bentangkan ulama mana yg kata demikian akad mana yg digabungkan seluruh produk gabung akad,https://x.com/undefined/status/1991447539858726987
,macam malaysia lah ada produk haram dibuat penyelesuaian untuk jadi halal seperti bacon tetapi ditukar kepada beef chicken bacon hahaha,https://x.com/undefined/status/1991064696796102899
,ada aku fitnah dia buat loan pakai produk cb tiada kan apa yang aku cakap itu fakta safdar lagi redha simpan duit dia dalam cb yang mana dia tahu cb akan pakainya untuk pelaburan haram berbanding ib kononnya berdosa part mana aku fitnah,https://x.com/undefined/status/1991008475560939553
,bapaknya hana kalau lihat hana post norak kampung sok egdy haram begini ga kebayang ngamuknya gimana he loves hana more than anything else in this world tapi pasti akan sangat kecewa dan marah kalau segagal ini produk jadinya parenting kami di usia 20 an,https://x.com/undefined/status/1990638219080446214
,wkwkwk produk hasil uang haram,https://x.com/undefined/status/1989231344807997860
,kalo karmin haram berarti banyak produk yg berwarna merahpink di indo ga lolos izin edar halalnya dong karmin itu halal yaaa dan banyak produsen pake pewarna karmin itu sendiri coba cari aja produk yg warna merahpink pasti pake itu dan ada logo halal,https://x.com/undefined/status/1989225518357676142
,kadang kita ni kalau dh kerap berjalan maka kita akan beringat tentang halal dan haram mcm mana nk classify kan produk dgn tempat makan ni jenis taktau apa pergi pun x ader nk buat research dulu kadang aku rasa jenis mcm ni pun mkn kedai makan x halal sebab nmpk org melayu,https://x.com/undefined/status/1989208374379213182
,produk haram konstitusi,https://x.com/undefined/status/1989021489639952885
,produk kosmetik halal bukan hanya bebas dari bahan haram tetapi juga harus aman bermanfaat serta diproduksi dengan cara yang etis dan ramah lingkungan selengkapnya di,https://x.com/undefined/status/1988913330971410652
,personally gapernah cocok pake produk wardah anjir sedih berasa muka w yang haram,https://x.com/undefined/status/1988449497673036164
,non halal tidak sama dengan ilegal haram tidak berarti ilegal ada produk haram tapi legal ada produk halal tapi ilegal menyamakan produk haram ilegal adalah kesesatan berpikir yg tidak seharusnya dimiliki pejabat,https://x.com/undefined/status/1988444409193771484
,gara gara ga dapat produk halal haram ahir nya banting setir ikut urusin ijazah,https://x.com/undefined/status/1988242882201813048
,udah ga dapat produk halal haram maka pindah ke urusan ijazah sapa tau ada yang minta fatwa,https://x.com/undefined/status/1988242440495694042
,kerana sudah ada bukti atau kritikan dalam produk islamic banking yang bermasalah dulu baiinah patuh syariah sekarang fatwa sudah haram jadi produk yang lain juga perlu disemak berdasarkan bukti baru,https://x.com/undefined/status/1988236257311551750
,yg hobi motong video clipper melanggar hak intelektual orang lain mencuri yg memfollowsubscribe akun clipper tsb juga ikut berperan membantu pencurian tsb krn income dr iklan depend on jmlh subscriber income tsb dr byk iklan produk haram judol miras pinjol dll,https://x.com/undefined/status/1988120028378788092
,haram di bursa saham aja perusahaan rokok ga masuk saham syariah karena menjual produk non halal non halal makruh non halal haram,https://x.com/undefined/status/1987817549120385525
,nak jadi specialist baru boleh faham pinjam 100 000 bayar 150 000 itu riba ke ke kena jadi specialist supaya diiktiraf yahudi atas jasa menghalalkan produk riba haram mereka,https://x.com/undefined/status/1987779477502558267
,produk si cungkring inimah haram jaddah,https://x.com/undefined/status/1987463348066398328
,dunia kok di kejar sampe segitunya ya maksud aku tuh kenapa sampe malsuin produk memperkaya diri dengan cara haram menipu,https://x.com/undefined/status/1987317583113298006
,haih pelik ingtkan blik mlysia dah takyah risau dh shopping groceries pasal halal haram nah still kene check jugak penatlaaa do plislaaa kedai2 memana asingkanlaaa produk mana jakim certify ngn produk mana takde tak kesahlaaa tu bukan daging babi ke ape,https://x.com/undefined/status/1987149673484996960
,kenapa ek kedai groceries nama dh melayu dah teknology dh cnggih dah ade self payment punye kaunter tapi produk halal haram cam tak pandai asingkan macam arak tu dy asingkan laa ni beef import dri aussie tu tak clarify pon halal atau tak jajan import sume tu,https://x.com/undefined/status/1987149670402215963
,buat yg muslim klo nemu coffee shop pny menu coffee bla bla bla with baileys baileys nya haram yagesya itu salah satu produk minuman beralkohol blacklist aja coffee shop nya for good,https://x.com/undefined/status/1987102201618301114
,jua dan beli kan ga ada haramnya bedanya ini produk digital kalau dibilang haram ya salah lalu untuk apa ada tokped dan shopee kalau produk digital itu haram walaupun bedanya tokped dan shopee ada barang fisik yg kita terima,https://x.com/undefined/status/1986868036729794634
,5 geng yang tolak atau yang terima islamic finance dua2 akui masih banyak kelemahan dan ruang penambahbaikan untuk slow2 ubah sistem 6 untuk orang awam sekurang2nya kalau guna ib hiyal apa semua pun dari segi akad masih tak riba dan produk tu tak gharar atau pi ke aset haram,https://x.com/undefined/status/1986425321063858495
,setidaknya warga bisa bantu dengan tidak ikutan judi produk ada karena ada target pasarnya ada konsumennya kalau pengguna judi online sepi nanti kan akhirnya mati juga pasar haram satu itu,https://x.com/undefined/status/1986226273681875211
,another produk of uang haram jadi tololnya ultimate,https://x.com/undefined/status/1986084214656348368
,nasihat salah kau ni produk haram tu,https://x.com/undefined/status/1985986952752181529
,yakin pak boleh la sesekali diskusi terbuka sama fg macam saya terkait halal haram produk derivatif,https://x.com/undefined/status/1985576755386864036
,vape tingkatkan kawal selia banteras produk haram,https://x.com/undefined/status/1985381916749828172
,pendapat saya jakim ini fungsinya memudahkan pengguna islam utk consume sesuatu produk agar apa yg kita gunakan itu bersih dan tak meragukan adapun kita disarankan untuk mengelakkan syubhah dan afdhal menjauhi perkara yg kita tidak tahu halal atau haram sesuatu produk,https://x.com/undefined/status/1985306977535496455
,stor haram premis jual ubat tidak berdaftar diserbu rampasan lebih rm6 juta rampasan 402 jenis ubat tidak berdaftar termasuk produk keluaran luar negara daripada pembekal tidak sah,https://x.com/undefined/status/1984816429179551827
,tak abis abis nak jadi beban negara suka nau cari pasal dengan masyarakat padahal zus coffee ada gigi coffee ada lagi la produk malaysia nak juga jenama haram isrel tu bodohh punya tiong,https://x.com/undefined/status/1984756610531819983
,haram bekerja di perusahaan yang menjual produk dari penipuan pemalsuan atau mengabaikan kerugian konsumen termasuk membantu dalam maksiat yang dilarang dalam islam karena melibatkan unsur ghulul dan penipuan carilah rezeki halal di tempat lain untuk menjaga keberkahan,https://x.com/undefined/status/1984599213704192191
,produk yang diklasifikasikan sebagai ubat tradisional didapati mengandungi bahan berbahaya dan tidak mematuhi piawaian keselamatan,https://x.com/undefined/status/1984218704494973304
,hal yg menguatkanku amanda tidak mba dia warnai rambutnya dia kuteks kukunya dia pakai skincare padahal produk tersebut ratarata berbahan kimia tidak semua diperbolehkan dokter dgn piciknya para pongpong mantan pemuja kapal haram menarasikan hal buruk tersebut,https://x.com/undefined/status/1983726553424089438
,jajan yg dimakan jungkook si kancho itu scr kandungan gak mengandung b2 tp ada keterangan kalo kemungkinan bs kecampur b2 krn produksinya di pabrik yg sama dgn produk yg mengandung b2 bagi yg muslim itu tetep haram yaa kecuali semua alat udh dicuci sesuai syariat islam,https://x.com/undefined/status/1983520728839581722
,yg aneh halalharam hny di tetapkan pd produk bukan pd perilakuperbuatan sungguh lucu negeri ini penuh dgn orang mabuk agama,https://x.com/undefined/status/1983104868819853576
,negeri makin tolol padahal produk haram belum tentu lebih buruk gini nih kalo shariah diterapkan janjinya manis tapi prakteknya bisa beda sama sekali,https://x.com/undefined/status/1983034162195181819
,anda produk cacat konstitusi pemilu curang penghitungan curang wakil anda anak haram konstitusi,https://x.com/undefined/status/1982782414523884011
,dalam term sertifikasi halal non halal ada 2 definisi 1 belum tersertifikasi halal kemungkinan ada kandungan haram 2 jelas ada kandungan haram jika poin satu ada pada pu yg tersertifikasi halal maka harus dilakukan pemisahan dari lini produksi produk halal,https://x.com/undefined/status/1982754993628483591
,klarifikasi dulu di 2025 semua kerugian amp korupsi itu akibat dari manajemen busuk era dia yg paling busuk saat pemilu terakhir msh berstatus presiden tapi menjadi juru kampanye anaknya si produk haram demokrasi bahkan bagi bansos dari uang negara tapi diklaim dr pribadi dll,https://x.com/undefined/status/1982222774103138792
