username,full_text,tweet_url
,ditarik karna blm lolos bpom menurut sertifikasi halal dan kesesuaian pangan indo kenapa dikatakan merusak ginjal karna ada ingredients yg over ga sesuai standarisasi makanan indo jangan apa2 mikirnya pengen persenan doang,https://x.com/undefined/status/2002060854821597363
,guyssss untuk kalian yang punya usaha makananminuman yang mau didaftarin sertifikasi halal boleh bgt pc aku yaaa free yaaaa ga dipungut biayaaa,https://x.com/undefined/status/1998687534310957226
,umkm wajib tahu batas sertifikasi halal kian dekat mulai 17 oktober 2026 produk makanan minuman dan hasil sembelihan usaha mikro dan kecil umk wajib memiliki sertifikat halal kenapa ini penting,https://x.com/undefined/status/1998391292091666513
,minimal lu taulah audience indo kek gimana soal makanan ga ada sertifikasi halal aja udah jadi concern apa lagi jokesnya pake bawa2 daging tikus ngejokes kek gitu mending keep di circle lu aja ga usah ke publik,https://x.com/undefined/status/1997510408496914646
,jepang secara aktif mempromosikan makanan halal untuk menarik wisatawan muslim seperti melalui sertifikasi halal oleh bisnis lokal demi ekonomi sumber researchgate ini bentuk akomodasi sukarela bukan pemaksaan namun ada kontroversi seperti keluhan,https://x.com/undefined/status/1996521351449026835
,urus izin halal mie instan ingin mengurus perizinan halal untuk keperluan usaha anda pt konsultan legal indo siap membantu anda untuk mengurus perizinan sertifikasi halal seperti produk makanan minuman kosmetik dan baran selengkapnya di,https://x.com/undefined/status/1995816089025147330
,sertifikasi halal memperkuat daya saing industri makanan dan minuman,https://x.com/undefined/status/1994607311269278051
,memiliki sertifikasi halal artinya kamu tidak perlu ragu lagi saat membeli makanan atau barang jaminan bahwa produk tersebut halal dan aman sesuai standar,https://x.com/undefined/status/1994601426497245450
,terus terang saja sertifikasi halal tujuannya lebih kepada dapat duit hingga rantai makanan pun diharamkan 1 level trus nanti besok2 2 level 3 level,https://x.com/undefined/status/1994042288184717617
,info yang jual usaha makanan belum sertifikasi halal dongg,https://x.com/undefined/status/1993254349330661425
,dari makanan siap saji sampai bahan kimia semua produk berlomba dapat sertifikasi halal cek 10 produk teratas di gambar l,https://x.com/undefined/status/1993249988110086359
,euy infokan penjual makanan minuman jajanan di bandung dsk yg udah sertifikasi halal kalau bisa yg disertifikasi lembaga kredibel sok sieun tuang di luar teh dosana gede info dari yg diajarkan ustadz di kajian kalau makanminum yg gak halal,https://x.com/undefined/status/1992907566574174658
,ya ibarat kan bang syukur kalo muslim emang udah diwajibin buat selektif milih makanan apalagi sertifikasi halal kan ketat masa iya literally disuruh kitab sucinya tp masi salah milih makanan berarti emang reading comprehension nya jelek,https://x.com/undefined/status/1991878380611064123
,tapi kalau gitu redudansi atau pengulangan kata jadinya kata halal nya di tulis 2 kali gimana kalau setiap makanan dan minumal wajib berserfirikasi dari mui atau sekarang yang membawahi sertifikasi halal siapa ya,https://x.com/undefined/status/1991722252497526873
,adakah sertifikasi untuk makanan tidak halal,https://x.com/undefined/status/1991659781363585257
,indonesia itu berpenduduk mayoritas muslim sejatinya makanan halal jauh lebih banyak ketimbang non halal program yg logis amp hemat biaya adalah sertifikasi makanan non halal begitu ada cuannya semua mau diatur rakyat juga yg menanggung bebannya jangan jadi pemeras rakyat,https://x.com/undefined/status/1991561684725690750
,logika yg kebalik di mayoritas negara muslimharusnya yg di sertifikasi adalah makanan non halalbukan malah yg halallagi2 bisnis mui,https://x.com/undefined/status/1991490420103315630
,kalo jual makanan kucing wajib sertifikasi halal juga kah takut kucingnya muslim kalo asal jual,https://x.com/undefined/status/1991482480692719785
,ada aja akal bulusnya buat malak rakyat lagi ni menag dg embel2 sertifikasi halal buat semua produk makanan duit dr tambang sama dana haji masih kurang kah,https://x.com/undefined/status/1991435978469437818
,negara mayoritas muslim pake sertifikasi halal aja udah aneh seharusnya cukup makanan non hala aja yg dikasih sertifikasi non halal karna jumlah mereka lebih dikit dan lebih enak diatur emang dasarnya ni negara kocak,https://x.com/undefined/status/1991427123228393779
,urus izin halal olahan eskrim ingin mengurus perizinan halal untuk keperluan usaha anda pt konsultan legal indo siap membantu anda untuk mengurus perizinan sertifikasi halal seperti produk makanan minuman kosmetik dan bar selengkapnya di,https://x.com/undefined/status/1991423339928383660
,good news dari mananya ini halalharam makanan itu pengetahuan umum bagi muslim gak perlu ada sertifikasi toh kalaupun yg makanminum gak tau gak akan dosa juga masih lebih logis sertifikasi keamanan pangan daripada sertifikasi halal,https://x.com/undefined/status/1991423269292163408
,indonesia negara muslim yg katanya terbesar tp msh sibuk sertifikasi makanan halal seharusnya yg disertifikasi adalah makanan nonhalal kok yg muslim yg jumlahnya lbh byk malah sulit mau makan,https://x.com/undefined/status/1991388005635092821
,btw makanan halal itu bukan harus melalui uji sertifikasi kan siapa yang bayar biayanya,https://x.com/undefined/status/1991387259791372542
,pemerintah memberikan waktu pelaku usaha untuk melakukan sertifikasi halal pada semua produk hingga oktober 2026,https://x.com/undefined/status/1990347427388227915
,bagi konoha lebih penting sertifikasi halal semua produk daripada terpapar nuklir keracunan mbg saja dianggap biasa apalagi nuklir presiden nya jalan2 keliling dunia masa bodo coba ada kasus di pabrik itu ada makanan mengandung babi pasti pemerintah dan mui lgs nge gas,https://x.com/undefined/status/1989441278774493591
,5 bahan baku makanan yang wajib halal untuk urus sertifikasi halal,https://x.com/undefined/status/1989190723984609412
,kolaborasi yang patut diapresiasipentiing sekali sertifikasi halal untuk produk mbg supaya anak anak aman dari makanan ya g tidak halal,https://x.com/undefined/status/1988971422430204150
,penting banget nih bagi produsen makanan untuk punya sertifikasi halal resmi konsumen indonesia mayoritas muslim dan butuh jaminan itu,https://x.com/undefined/status/1988386291843821810
,urus izin halal coklat olahan ingin mengurus perizinan halal untuk keperluan usaha anda pt konsultan legal indo siap membantu anda untuk mengurus perizinan sertifikasi halal seperti produk makanan minuman kosmetik dan bar selengkapnya di,https://x.com/undefined/status/1986740957870760238
,di solo gibran memajukan umkm kuliner lewat program pelatihan akses modal murah dan sertifikasi halal yang dorong daya saing pelaku usaha upaya ini tak hanya angkat satu jenis makanan tapi bangun ekosistem pariwisata kuliner yang tarik wisatawan dan tingkatkan pendapatan,https://x.com/undefined/status/1986285595023581460
,terima kasih atas apresiasinya sertifikasi halal pada kulkas memang dirancang untuk menjamin kemurnian bahan yang bersentuhan dengan makanan menghindari kontaminasi tidak terlihat seperti alkohol dalam lapisan atau lemak najis ini bagian dari prinsip islam yang luas soal,https://x.com/undefined/status/1985924036908761466
,sertifikasi halal untuk kulkas memastikan bahan baku proses produksi dan rantai pasok bebas dari unsur haram seperti lemak babi alkohol atau kontaminasi najis sehingga tidak mencemari makanan secara tidak langsung halal secara luas berarti suci dan diperbolehkan menurut,https://x.com/undefined/status/1985919466224656469
,tidak dinas ketahanan pangan tidak memiliki wewenang khusus untuk menyelidiki atau menyatakan status halalnonhalal makanan yang dijual ke masyarakat sertifikasi halal diatur secara terpusat oleh badan penyelenggara jaminan produk halal bpjph dan majelis ulama indonesia,https://x.com/undefined/status/1985915685298716913
,bukan tapi hanya masalah adminitratif lagi ngurus sertifikasi halal non halal bukan karena makanan mengandung bahan haram tapi cuma belum terdaftar aja tapi petugas sudah langsung masang stiker non halal aja,https://x.com/undefined/status/1985582865728643093
,lho salahnya dimana stop him when hes telling lies makanan aja harus ada sertifikasi halal mayoritas kalo ngadain terop gedean kalo yang minoritas protes dianggep kafir kalo yang minoritas ngadain doa kecilan digebukin bahkan sampw dibacok padahal ini negara pancasila,https://x.com/undefined/status/1985559665959485609
,lho salahnya dimana stop him when hes telling lies makanan aja harus ada sertifikasi halal padahal negara indonesia negara pancasila bukan negara muslim,https://x.com/undefined/status/1985557144285168089
,mantap nih produk dengan sertifikasi halal memang sangat membantu saat kita mau belanja makanan,https://x.com/undefined/status/1985173382070202418
,karena dengan sertifikasi halal membuat saya sebagai konsumen merasa lebih aman dan nyaman dalam mengkonsumsi makanan yang saya beli,https://x.com/undefined/status/1985171378631565494
,syaratnya emang jauh lebih mudah drpd urus sertifikasi halal ut makanan,https://x.com/undefined/status/1984722013056090426
,hello skrg semua yg kerja di dapur mbg hrs punya sertifikasi penjamah makanan dapur hrs punya slhs halal next haccp iso 45000 dan iso 22000 all berhubungan dgn higienitas untuk rasa dapur mbg sdh mulai diwajibkan pakaididampingi chef bersertifikasi,https://x.com/undefined/status/1984158644355920335
,makanan tdk halal skrg pake sertifikasi non halal,https://x.com/undefined/status/1983084607596908568
,proses sertifikasi halal pahami 2 syarat kritis amp kategori,https://x.com/undefined/status/1982987453368803630
,polisi mengelola sppg sebagai satuan khusus polri untuk mendukung program makanan bergizi gratis mbg pemerintah sppg bertanggung jawab atas produksi pengolahan dan distribusi makanan yang aman higienis serta memenuhi standar gizi tinggi termasuk sertifikasi halal dan,https://x.com/undefined/status/1982845304614670467
,pp no 42 tahun 2024 mewajibkan pelaku usaha produk makananminuman obat hingga kosmetik untuk menuntaskan sertifikasi halal paling lambat 17oktober2026,https://x.com/undefined/status/1982762872150393210
,dalam rapat evaluasi pelaksanaan program sppg menyoroti pentingnya pengawasan terpadu dan disiplin penerapan sop guna mencegah kembali terjadinya kontaminasi makanan pembentukan satgas lintas lembaga peningkatan higienitas serta percepatan sertifikasi slhs dan halal menjadi,https://x.com/undefined/status/1982077109037383814
,sertifikasi halal buat ribuan warteg dan warmindo ini bukan cuma soal label tapi soal menjaga kualitas kepercayaan dan identitas bangsa makanan enak aman dan penuh keberkahan,https://x.com/undefined/status/1981924435683930594
,yang ada di indonesia itu sertifikasi halal bukan informasi haram jadi tidak ada kewajiban tempat makan memberitahu makanan tidak halal kalau enggak ditanya tidak memberitahu kalau makanan di tempatnya haram menipu pelanggan,https://x.com/undefined/status/1981402475984015573
,mulai sekarang makanan gratis dari pemerintah wajib halal setiap dapur sppg harus punya penyelia halal tersertifikasi,https://x.com/undefined/status/1980105106612990236
,satgas mbg kulonprogo soroti kualitas makanan dan sertifikasi halal,https://x.com/undefined/status/1979189756006199691
,seharusnya memang begitu yg perlu diperhatikan adalah 1 dapurnya sudah mempunyai ijin layak hygene 2 petugasnya mempunyai sertifikat ijin menjamah makanan 3 petugasnya tidak mengidap penyakit dengan bukti mcu terbaru 4 bahan baku termasuk air sertifikasi halal 5 ada sop,https://x.com/undefined/status/1979101288085492109
,dua lembaga satu visi makanan halal sehat dan bergizi untuk semua kolaborasi implementasikan sertifikasi halal pada sppg,https://x.com/undefined/status/1978687103211815040
,sertifikasi halal di mbg bukan cuma formalitas tapi bukti komitmen bpjph dan bgn untuk keamanan dan kehalalan makanan,https://x.com/undefined/status/1978686762466578691
,mantap nih bpjph dan bgn kolaborasi untuk implementasikan sertifikasi halal pada sppg nantinya makanan yang dibagikan dijamin layak konsumsi,https://x.com/undefined/status/1978686087917609466
,bpjph bersama bgn akan mulai terapkan sertifikasi halal di tiap dapur mbg sehingga makanan mbg dijamin kehalalannya,https://x.com/undefined/status/1978686087842406461
,bener banget sertifikasi halal bukan untuk produk makanan saja namun produk2 lainnya juga perlu,https://x.com/undefined/status/1978068679205016039
,gais yg punya usaha makananminuman trs mau ada sertifikasi halal produknya boleh dm aku ya prioritas kab semarang kota semarang salatiga kendal nanti aku bantu pendampingannya nggak ada biaya free resmi amp legal yang minat atau tanya dmhubungi wa 085319456320,https://x.com/undefined/status/1977972198142099602
,ikm jawa barat saatnya naik kelas dengan produk halal dan berdaya saing disperindag jabar membuka fasilitasi sertifikasi halal bagi pelaku usaha produk makanan dan minuman yuk pastikan produkmu tidak hanya lezat dan berkualitas tapi juga aman halal dan penuh keberkahan,https://x.com/undefined/status/1977933439392501811
,pengawasan ketat diterapkan dalam program mbg melalui sertifikasi slhs haccp dan halal tujuannya jelas makanan bergizi yang aman untuk anak bangsa,https://x.com/undefined/status/1975035430715470020
,slhs haccp dan sertifikasi halal di program mbg bikin kualitas makanan anakanak makin terjaga,https://x.com/undefined/status/1974747184525672739
,pemerintah menegaskan komitmennya menjaga kualitas mbg lewat tiga sertifikasi slhs haccp dan halal langkah ini memastikan setiap makanan aman higienis dan layak konsumsi dengan sistem terpadu ini masa depan anak bangsa makin sehat dan kuat mari bersama,https://x.com/undefined/status/1974707729756525003
,kepala badan penyelenggara jaminan produk halal bpjph ahmad haikal hasan tegaskan indonesia akan masuki era wajib halal pada 2026 pemerintah berlakukan wajib sertifikasi halal semua produk yang dijual di indonesia tidak hanya produk makanan dan minuman tetapi juga kosmetik,https://x.com/undefined/status/1974301369885741527
,pastikan harus ada sertifikasi halal dulu kalo aku beli makanan kemasan dan scann supaya bner bner halal,https://x.com/undefined/status/1974298596767117552
,sertifikasi keamanan pangan kan udah ada bpom pangan segar minimbelum diolah udah ada okkp daerah dan pusat makanan halal udah ada bpjph,https://x.com/undefined/status/1974238300987908418
,mencegah kasus keracunan mbg menjadi klb nasional menkes budi tetapkan dapur makanan mbg harus memiliki slhs haccp dan sertifikasi halal,https://x.com/undefined/status/1973713131579769057
,bpom adalah badan pengawas obat dan makanan yang mengawasi keamanan pangan secara umum lppommui mungkin yg dimaksud lpom fokus pada sertifikasi halal lembaga baru dari bgn ini independen khusus sertifikasi untuk program makan bergizi gratis termasuk slhs dan haccp untuk,https://x.com/undefined/status/1973420267952361808
,chef harus sertifikasi duit lagi dapur harus sertifikasi halal duit lagi harus ada ahli gizi duit lagi endingnya budget makanan jd kaya nasi kucing 5000 per porsi,https://x.com/undefined/status/1973093161846059389
,dulur makmur berikut kilasan workshop sertifikasi laik higiene sanitasi slhs sertifikasi halal sertifikasi umkm penjamah makanan bagi sppg kabupaten sukoharjo yang digelar ruang rapat wijaya 1 gedung menara wijaya sukoharjo selasa 3092025,https://x.com/undefined/status/1972908889562902737
,urus izin halal kue basah ingin mengurus perizinan halal untuk keperluan usaha anda pt konsultan legal indo siap membantu anda untuk mengurus perizinan sertifikasi halal seperti produk makanan minuman kosmetik dan barang selengkapnya di,https://x.com/undefined/status/1972592830897119704
,sppg secara 90 lebih bermasalah kok 8583 sppg cuman 34 yang punya slhs haha padahal mbg udah berapa lama km mau makan ke tempat yg ga ada sertifikasi halal km mau makan ke tempat yg ga ada sertifikasi higiene dan sanitasi tapi kamu biarin anak2 makan makanan yg ga,https://x.com/undefined/status/1971028638683508785
,tahukah kamu terdapat batas waktu bagi pelaku umk dan pelaku usaha dari luar negeri untuk melakukan sertifikasi halal bagi produk makanan minuman hasil sembelihan dan jasa penyembelihan,https://x.com/undefined/status/1969571570160189487
,sertifikasi halal di indonesia memang bergeser dari mui ke bpjph sejak 2019 dengan bpjph mengeluarkan sertifikat berdasarkan fatwa mui ada laporan masalah kontaminasi seperti minyak babi di produk makanan misalnya permen pada mei 2025 menurut bpjph namun untuk keamanan,https://x.com/undefined/status/1969305659444511001
,hah kalo konsepnya gini berarti resto2 korbeq yg jual samgyeopsal bisa dpt sertifikasi halal dong pdhl pas gue bljr ttg sjh alat yg dipake utk makanan haram dan halal harus dipisah,https://x.com/undefined/status/1969221518551912696
,lahhhh lo baca sana regulasi indo itu emang sekarang mewajibkan sertifikasi halal untuk semua produk barang dan jasa yang diedarkan diperdagangkan dan digunakan di indonesia termasuk makanan minuman obatobatan kosmetik obatobatan alami dan produkproduk lain,https://x.com/undefined/status/1969189426594025976
,mulai 17 oktober 2024 penerapan wajib sertifikasi halal telah memasuki tahap pertama artinya produk makanan minuman bahan baku hasil sembelihan dan jasa penyembelihan wajib bersertifikat halal,https://x.com/undefined/status/1968573275795025943
,anda pelaku usaha mikro kecil makanan minuman belum memiliki sertifikasi halal gratis hubungi kami khususnya untuk yang berada di kabupaten dan kota bekasi,https://x.com/undefined/status/1968513210115354904
,negara punya lembaga gizi nasional bp pom lembaga sertifikasi halal mrk dpt gaji dr rakyat tiap bulan trus kerjanya apa buta masih ada yg keracunan soal makanan bergizi gratis apa perlu negara bwt satgas mbg,https://x.com/undefined/status/1968511432695394449
,urus izin halal untuk kue ingin mengurus perizinan halal untuk keperluan usaha anda pt konsultan legal indo siap membantu anda untuk mengurus perizinan sertifikasi halal seperti produk makanan minuman kosmetik dan barang selengkapnya di,https://x.com/undefined/status/1968277956750635055
,emil jay idzes senin apel pagi hari pangan anda pelaku usaha mikro kecil makanan minuman belum sertifikasi halal kami bantu utk wilayah kota dan kab bekasi hub dm,https://x.com/undefined/status/1967798930986635750
,lagi banyak makanan malah ada audit sertifikasi halal wkwkwkwkwkwkwk,https://x.com/undefined/status/1967777545442693210
,dorong kualitas makanan warga binaan rutan perempuan medan jalin kerja sama dengan lph untuk sertifikasi halal medan 15 september 2025 baca selengkapnya,https://x.com/undefined/status/1967445701316825294
,senin sarapan verdonk lilipaly mari bagi pelaku usaha mikro kecil makanan minuman yang mau sertifikasi halal lokasi kabkota bekasi hub tulis produklokasi,https://x.com/undefined/status/1965227498020757615
,sampurasun sadayana kumaha damang aku bintala di sini udah nyiapin berbagai makanan untuk disantap malam ini silahkan diliatliat dulu sambil didengerin backsound sabilulungan biar aduhay tenang aja guys makanannya 100 halal dan tidak beracun udah ada sertifikasi halal,https://x.com/undefined/status/1964259202043420924
,urus izin halal plastik makan ingin mengurus perizinan halal untuk keperluan usaha anda pt konsultan legal indo siap membantu anda untuk mengurus perizinan sertifikasi halal seperti produk makanan minuman kosmetik dan bar selengkapnya di,https://x.com/undefined/status/1963530228137128302
,bem ui kebutuhan gibran mowning kalau punya teman yang buka usaha makanan dan minuman belum punya sertifikasi halal bisa saya bantu gratis sah dari bpjphkemenagmui,https://x.com/undefined/status/1963433434157814138
,pelaku usaha mikro dan kecil produk makanan minuman mari merapat urus sertifikasi halal,https://x.com/undefined/status/1963053020331311346
,berdaya bersyariah pada sosialisasi izin edar dan sertifikasi halal fesyar kti kalbar kepala bbpom di pontianak fauzi ferdiansyah memberikan edukasi sertifikasi produk obat dan makanan pada event festival ekonomi syariah kawasan timur fesyar kti,https://x.com/undefined/status/1961951305796395465
,program makan bergizi gratis di paron ngawi terhenti setelah dua hari dprd soroti makanan basi hingga sertifikasi halal dapur mitra,https://x.com/undefined/status/1961681562690355692
,negara gedung dpr ri salsa kamis bekasi demokrasi tertib semangka raih sertifikasi halal gratis bagi pelaku usaha mikro dan kecil makanan minuman hub,https://x.com/undefined/status/1960953836094546357
,makanan sehat dan halal bakal selalu ada berkat sertifikasi bpjph yang dipercepat buat program mbg,https://x.com/undefined/status/1960220042378817651
,setuju sekali dengan adanya sertifikasi halal kualitas dan kehalalan makanan lebih terjamin,https://x.com/undefined/status/1960187616734945715
,sangat mengapresiasi sinergi antara bpjph dan program mbg sertifikasi halal menjadi jaminan penting untuk memastikan makanan masyarakat tidak hanya bergizi tapi juga aman dan sesuai syariat langkah ini menunjukkan komitmen serius untuk kesejahteraan masyarakat indonesia,https://x.com/undefined/status/1960182853913698543
,bpjph dukung penuh program mbg dengan percepatan sertifikasi halal bersinergi dengan bappenas amp bgn pastikan makanan bergizi aman sehat dan terjamin kehalalannya demi kepercayaan publik,https://x.com/undefined/status/1960182720887169207
,inisiatif bpjph percepat sertifikasi halal bikin makanan sehat dari mbg makin eksis di masyarakat,https://x.com/undefined/status/1960180965336031467
,urus izin halal restoran ingin mengurus perizinan halal untuk keperluan usaha anda pt konsultan legal indo siap membantu anda untuk mengurus perizinan sertifikasi halal seperti produk makanan minuman kosmetik dan barang g selengkapnya di,https://x.com/undefined/status/1959930151313313872
,aman dari api serangan tikus petir hingga tegangan listrik yang naik turun ini dia kulkas yang elegan sekaligus terjamin keamanannya dengan 7 perlindungan lengkap dengan sertifikasi halal dan perlindungan ion plasmacluster yang menjaga kesegaran makanan 24 jam nonstop,https://x.com/undefined/status/1959056183903625671
,bekasi bmkg gabut sesar pelaku usaha mikro dan kecil jenis makanan dan minuman belum sertifikasi halal batas akhir 17 oktober 2026 mari hub kami bantu,https://x.com/undefined/status/1958325582879764889
,hayo sertifikasi halal kan produk makanan anda jangan terlambat,https://x.com/undefined/status/1958000194043408760
,perijinan siup sertifikasi halal mui untk produk makanan ijin bpom begitu,https://x.com/undefined/status/1956623603623190625
,tingkatkan standar pemasaran lapas perempuan bandar lampung lakukan sertifikasi halal produk olahan snack dan makanan lampunginfo pas produk kuliner lapas perempuan bandar lampung lakukan sertifikasi halal bersama kantor urusan agama kua kedaton,https://x.com/undefined/status/1955455398515036175
,tingkatkan standar pemasaran lapas perempuan bandar lampung lakukan sertifikasi halal produk olahan snack dan makanan lampunginfo pas produk kuliner lapas perempuan bandar lampung lakukan sertifikasi halal bersama kantor urusan agama kua kedaton,https://x.com/undefined/status/1955441103068705097
,urus izin halal alat dapur ingin mengurus perizinan halal untuk keperluan usaha anda pt konsultan legal indo siap membantu anda untuk mengurus perizinan sertifikasi halal seperti produk makanan minuman kosmetik dan barang selengkapnya di,https://x.com/undefined/status/1955193563043750089
,ini kalau elektronik pake sertifikasi halal tuh ga nyolong dari kebun orang kah misalnya atau bikinnya bismillah dulu atau gimana ya cuma tau makanan doang ak,https://x.com/undefined/status/1955117317337256408
,kami menyadari perkembangan pesat industri halal indonesia terutama di bidang makanan mode farmasi dan kosmetik kata dina boluarte,https://x.com/undefined/status/1954785747548193220
,tantangan dan harapan usaha ini terkendala legalitas bpom untuk bisa ekspor ke luar negeri harapan terbesar adalah menjadi pengusaha makanan indonesia yang go public ibu rohani berharap proses legalitas seperti sertifikasi halal nib dan haki bisa dipermudah,https://x.com/undefined/status/1954092458549105012
,sertifikasi halal restoran bukan hanya soal bahan makanan tapi mencakup sistem menyeluruh yang diaudit ketat dari dapur pusat gudang perilaku karyawan hingga peran pelanggan semuanya dinilai semua menu wajib halal tanpa pengecualian,https://x.com/undefined/status/1953702437518553555
,kasongan lapas narkotika kelas iia kasongan melaksanakan proses audit sertifikasi halal yang dilakukan oleh tim auditor dari badan penyelenggara jaminan produk halal bpjph sebagai bentuk komitmen dalam menjamin kualitas dan kehalalan makanan bagi warga binaan rabu 68,https://x.com/undefined/status/1952989748773175302
,demikian pula dengan penghapusan sertipikat halal untuk seluruh produk impor dari amerika yang kemudian menjadi syarat dalam tarif 19 syarat ini dapat membangkitkan sentimen agama sertifikas halal produk makanan merupakan syarat penting mereka mentaati ajaran agamanya,https://x.com/undefined/status/1950851774719643830
,urus izin halal produk sereal ingin mengurus perizinan halal untuk keperluan usaha anda pt konsultan legal indo siap membantu anda untuk mengurus perizinan sertifikasi halal seperti produk makanan minuman kosmetik dan bar selengkapnya di,https://x.com/undefined/status/1950473112388325580
,cak hum kita bangsa yang besar emang parah banget rasanya indo jadi wilayah federal amerika serikat tanpa sertifikasi dll fix makanan harom biar produk non halal semua bakalan membanjiri indonesia,https://x.com/undefined/status/1950181603499790494
