username,full_text,tweet_url
,bener juga ya lebih baik sertifikasi haram kan maksdunya,https://x.com/undefined/status/1889232692329468037
,jangan pakai katakata selfproclaim halal di nama restonya setelah pingpongan berkalikali akhirnya mereka mau takedown penamaan ini nah harapannya dg ada sertifikasi halal halhal semacam ini ga terjadi karena ada badan khusus yg inform pelaku usaha batasan halal haram,https://x.com/undefined/status/1889230051864088796
,jadi kepikiran biasanya di negara minoritas muslim kan baru muncul sertifikasi kyk gini lalu kenapa lu bikin aturan sertifikasi halal di negera mayoritas muslim maksud gue kenapa ngga dibalik aja pendekatannya tp bukan trus namanya sertifikasi haram juga,https://x.com/undefined/status/1889224602511098238
,harusnya sertifikasi haram,https://x.com/undefined/status/1889223589871993105
,mmmm nganu mas kalo sertifikasi khusus haram nanti jumlahnya dikit,https://x.com/undefined/status/1889220741809508685
,semua halal kecuali yang haram memang tapi haram gak cuma karena zatnya bisa jadi karena terkontaminasi alat produksi atau tercampur bahan yang bersifat haram itulah gunanya sertifikasi,https://x.com/undefined/status/1889217927020470593
,sertifikasi haram seharusnya,https://x.com/undefined/status/1889214939598111000
,bener bgt kalo pun ada harusnya ngga ada biaya kecuali sertifikasi haram tapi ngga mungkin juga kan,https://x.com/undefined/status/1889212783306403879
,emang paling bener tuh harusnya sertifikasi haram bukan sertifikasi halal sih lebih enak buat jelasin kenapa ini haram dan ga boleh kalau soal halal ga perlu sertifikasi inspeksi monitoring dll menurutku udah cukup,https://x.com/undefined/status/1889208681029586991
,lha wong 90 dari 270jt itu muslim kok pake sertifikasi halal kayane malah lebih perlu sertifikasicaplabel haram yg ribet soal ini jajane di warteg gak prnh tnya sertifikat halal yg ditnya malah bs ngutang dlu gak,https://x.com/undefined/status/1889201476276543682
,jadi yang haram wajib sertifikasi,https://x.com/undefined/status/1889200944463941967
,zalimnya klen ini kemarin kasus sertifikasi halal almaz diminta milyaran suka banget petinggi indo nih makan uang haram,https://x.com/undefined/status/1889197554296078830
,betul mestinya yg haram yg notabene minoritas yg dikasih tanda sertifikasi halal itu cuma lahan buat narik pemasukan aja sih,https://x.com/undefined/status/1889196842048536968
,ngurus sertifikasi halal dengan cara yang haram heheheheheheheh,https://x.com/undefined/status/1889195155686932848
,setuju klo emang sertifikasi harusnya sertifikat haram,https://x.com/undefined/status/1889193286780514331
,berarti hukum sertifikasi halalnya jadi halal atau haram,https://x.com/undefined/status/1889193259144196443
,harusnya yg bener tuh sertifikasi haram,https://x.com/undefined/status/1889192213273522687
,ya padahal klo mau ni sertifikasi halal itu untuk misal restoran chinese yg halal itu bisa atau restoran2 tempat makan halal di tengah2 penjual2 yg jual daging haram atau misal contoh di bali itu baru fair apa2 di sertifkat hallal tub ga make sense,https://x.com/undefined/status/1889190810752811063
,betul juga ya yang mayoritas tapi disuruh disertifikasi kalau dibalik sertifikasi haram bagaimana khusus yang haram saja ada label nya jadi umat islam tidak salah pilih,https://x.com/undefined/status/1889189327554654320
,seharusnya bukan sertifikasi halal tapi sertifikasi haram gitu maksudnya karena mayoritas muslim jadi gaperlu sertifikasi halal,https://x.com/undefined/status/1889186834133168413
,ya mendingan ada sertifikasi makanan haram gak siiih,https://x.com/undefined/status/1889185939752374576
,melihat fakta bahwa banyak muslim indonesia yg ga tau ajaran agamanya gw sih setuju sertifikasi halal halal zatnya aja masih banyak yg belum tau belum lagi halal prosesnya belum lagi sembelihan nonahli kitab yg haram makanya oke aja makan bebek yg cara ngolahnya dicekik,https://x.com/undefined/status/1889185330596823325
,tinggal makan tnp berpikir itu halal syubhat atau bahkan haram sertifikasi halal itu sebenarnya jd jawaban atas problematika tsb tp prakteknya yg jelek karena banyak oknum yg justru bermain curang,https://x.com/undefined/status/1889182752563757289
,prinsip kehati2an sih kak klo yg diwajibkan sertifikasi haram lebih susah ngedorong krn secara psikologis org ga mau dpt sertifikasi haram islam memudahkan tp syubhat jg hrs dihindari ini memang ranah pemerintah yg didorong itu agar mudah bukan dihilangkan sertifikasinya,https://x.com/undefined/status/1889179980095201352
,harusnya sertifikasi haram yg ada ya untung aja ga seperti itu repot mau jualan nanti,https://x.com/undefined/status/1889173182063796381
,ngurus sertifikasi halal tapi dipaksa melakukan hal yg haram setan aja minder bro,https://x.com/undefined/status/1888834729522221551
,whatt ngajuin sertifikasi halal tpi dimintain duit yang jatohnya jadi haram gitu,https://x.com/undefined/status/1888830555976011879
,bisa bgt tu ya rilis sertifikasi halal tapi cara haram yg begini ni penistaan agama sebenar2nya,https://x.com/undefined/status/1888828346932601003
,pengajuan sertifikasi halal eh oknum nya haram,https://x.com/undefined/status/1888821257598337226
,cuma mau bilang gaada sertifikasi halal bukan berarti makanannya langsung haram,https://x.com/undefined/status/1888806524606447843
,definisi sertifikasi halal tapi makan uang haram ya beginilah negeri ini,https://x.com/undefined/status/1888801808828813398
,gila sih ini ngurus sertifikasi halal tapi makan uang haram malaikatnya sampai bingung,https://x.com/undefined/status/1888801340576436550
,ngurus sertifikasi halal tapi pejabatnya makan duit haram,https://x.com/undefined/status/1888796775450120281
,ini mah bukan sertifikasi halal tapi sertifikasi haram,https://x.com/undefined/status/1888764442332237842
,warteg mah butuhnya sertifikasi higienitas bukan haram halalnya emang niat malak aja,https://x.com/undefined/status/1888686542702661829
,sertifikasi haram,https://x.com/undefined/status/1888584734831489251
,beneran nih 1 warteg biaya sertifikasi halal 10jt halal atau haram biayanya,https://x.com/undefined/status/1888549637545673200
,perkara nama menyerupai yg haram aja mui gk mau ngebolehin contohnya rootbeer yg meski halal tp gk lolos halal mui makanya aw ganti nama rootbeernya jadi rb biwr dapat sertif halal apalagi yg bentuknya menyerupai gitu biasanya malah gk dapat sertifikasi halal mui,https://x.com/undefined/status/1888514184070992192
,masyarakat indonesia mayoritas muslim asumsi dasar warung2 kebanyakan relatif halal yg dibutuhkan adalah sertifikasi haram harusnya begitu kok kebalik balik,https://x.com/undefined/status/1888471644420853855
,seharusnya yg di sertifikasi itu yang haram,https://x.com/undefined/status/1888455302699528508
,apa urgensi nya warteg di sertifikasi halal seharusnya produk yg haram dilarang,https://x.com/undefined/status/1887525612832891042
,please for muslim moots consider kalau mau beli skincare korea atau produk manapun yg belom ada sertifikasi halal cek dulu ingredientsnya pake translate kalo emng gaada englishnya ga semua produk yg gaada bahan haram bukan berarti aman dan halal dipakai,https://x.com/undefined/status/1885490682519052648
,sebenernya ya tinggal tinggalin aja kalau resto gabisa bilang halal or haram mau disebut halal ya emang ga ada sertifikasi mau disebut haram ya emang pake bahan yg bukan babi sama alkohol jadi ya jangan terlalu galak lah soalnya konsumen kan bisa milih untuk ga makan,https://x.com/undefined/status/1884829211900457079
,root beer jg terpaksa ganti nama di indonesia demi sertifikasi halal jadi semakin jelas ya halal haram cuma berdasarkan adanya nama bentuk seperti babi dsb khas standard frimitip,https://x.com/undefined/status/1882995877603852788
,rum essence udah haram mutlak tp setauku emang ga ada produk rum essence yg dapet sertifikasi halal mui atau ada yah,https://x.com/undefined/status/1881240041571463669
,hubungan boikot sama sertifikasi halal apa dah embg kita boikot karena produknya haram,https://x.com/undefined/status/1880107014266974209
,gaada hubungannya yah sertifikasi halal ama boikot dipikir kita boikot mekdi gegara dia haram apa,https://x.com/undefined/status/1880083098127553013
,shampoo mah dari dulu emang haram karena bikin mabuk ngapain bawa sertifikasi halal buat shampoo kocakkk,https://x.com/undefined/status/1879949371808293113
,di mata haikal hasan menu spt itu halal n dimata bpom diktkn lolos layak konsumsi mana suara nya bpom nhaikal hasan jangan pabrikan yg dikejar2 sertifikasi halal itu pisang pohon nya dipupuk dgn kotoran hewan berarti haram pula dapur msk nya haram tdk,https://x.com/undefined/status/1877254100384924090
,tibul buzzer hajar biar kapok ga makan uang haram dari junjungannya yg telah dapat sertifikasi korupsi dari occrp,https://x.com/undefined/status/1876636528111427990
,halal syubat dan haram untuk syubhat masih abu abu antara haramhalal perlu fatwa halal melalui proses sertifikasi halal,https://x.com/undefined/status/1876479961894400017
,soal keterangan haram sudah ada aturannya di negara ini wajib pelaku usaha memberikan keterangan haram di kemasan atau spanduk dll pelaku usaha tidak akan mau disertifikasi haram justru sertifikasi halal menjelaskan produk yang dlm status abu abu,https://x.com/undefined/status/1875682558295605456
,dulu sebenernya mui pake cap haram gambar babi kemudian dikasi kuasa sama orba ganti probis amp monopoli sertifikasi halal bahasan sejarahnya ada di majalah tempo,https://x.com/undefined/status/1875160670611853819
,alo aku baca2 walaupun essence rum ttp aja gabisa sertifikasi halal soalnya menyerupai produk rum haram huhu kudu ati2 emg kalo beli2,https://x.com/undefined/status/1875008758520348876
,sabun dll nya kena sertifikasi halal emg gratis ngurus sertifikasi halal ituhalal haram ditentukan oleh uang sebabkan hrg naik sertifikasi halal tsb,https://x.com/undefined/status/1874667021922947548
,lalu kapan hrg sembako itu turunhapuskan sertifikasi produk halal krn itu sebabkan hrg brg mjd mahal emg ngurus sertifikasi halal itu gratishanya nenambah hrg pokok produksi halalharam ditentukan oleh mnsnya jika ada uang urus jadi halal produknya,https://x.com/undefined/status/1874378985725178269
,kenapa sertifikasi halal bukan yg haram saja mgkn jumlahnya lebih sedikit sebab yg nampaknya halal bisa saja ternyata setelah diteliti ada kandungan yg haram inilah tugasnya auditor dan lembaga pensertikat memastikan yg subhat meragukan jd jelas,https://x.com/undefined/status/1872927150766207207
,numpang tanya misal di islam kan ada sertifikasi halal haram di agama lain perlu itu nggak sih atau fatwa2 tentang produkteknologimasalah baru,https://x.com/undefined/status/1871149681658691899
,tujuan sertifikasi halal adalah agar umat muslim tidak makan atau mengenakan yang haram dan sekarang sertifikasi itu diambil alih pemerintah maka mestinya pemerintahlah yang berinisiatif menguji semua yang harus disertifikasi itu secara gratis bukan dibebankan pada pengusaha,https://x.com/undefined/status/1870130439278735519
,ga usah sertifikasi pak ujungnya ntar kwatirnya bisa jd lahan pungli kan jd haram,https://x.com/undefined/status/1867897974527074644
,wong jelas uang 900 jt uang haram yo di badokgk mau kembalikan makin jelas etitut gk jauh dg mulut n bahasanya mendikdasmen tidak ada kenaikan gaji 2 juta bagi guru yang ada peningkatan kesejahteraan melalui sertifikasi apa maksudnya,https://x.com/undefined/status/1865413608458571835
,kalau haram tinggal pph bisikin aja ke temen yang ngurusin sertifikasi biar jadi halal bercanda mau dong mau dong yang banyak,https://x.com/undefined/status/1863430856444129487
,bikinnya sertifikasi haram juga dong jadi tambah jelas mana yg halal mana yg haramnya,https://x.com/undefined/status/1861013321786560907
,yang haram emang lebih enak breadtalk abis punya sertifikasi halal jadi ya gitu deh makanya salut banget sama fampb menu non indonesia halal yang beneran enak karena rampd nya pasti lama banget,https://x.com/undefined/status/1859854807076675749
,sertifikasi halalutk menyatakanproduk tersebutbahanbakunyaterbebas darikandungan2 unsurbabiserta turunannya tentunya bermanfaatbagi umatyg mengharamkanbabiatuh tak harambagi andabisajadi tak halalbagi kami,https://x.com/undefined/status/1858375279888224394
,onta jelas haram menjadi halal oleh eslam yang diharamkan hanya babi anehnya saat ini baygon wajib sertifikasi halal goblok goblok goblok ayo dilawan kebodohan yang makin masif ini,https://x.com/undefined/status/1855574325526749337
,karena tempat makannya udah kesentuh sesuatu yang haram kak halal itu bukan cuma dari bahan makanannya tapi alat yang dipakainnya juga apalagi dapet sertifikasi halal susah jadi buat menjaga ya mau gak mau harus ganti semua alat makannya cmiiw,https://x.com/undefined/status/1855320266974670923
,saya jualan obat an pertanian tapi blom mengurus surat buat sertifikasi halal dr emui apakah pestisida yg saya jual haram diaplikasikan kesawah buat mengendalikan wereng ulat grayak gulma dll,https://x.com/undefined/status/1854418185916977371
,seharusnya rezim prabowogibran ini perlu sertifikasi dan labelisasi halal juga karena kalo tidak bisa kena sanksi karena rezim prabowogibran ini berasal dari produk haram dari hasil pengangkangan konstitusi pencurangan aturan dan penyalahgunaan wewenang,https://x.com/undefined/status/1854203496058569185
,sertifikasi halal menjamin kehalalan suatu produk alkohol jelas jelas haram berarti yang memberi stampel halal di alkohol begonya kebangetan,https://x.com/undefined/status/1853979306332135433
,ya jangan begitulah kawan jgn main2in kata halal pembasmi nyamuk harus dpt sertifikasi halal krn dia akan menempel di pakaian dan kain2 rumah kita mgkn jg di sajadah kita krn itu wajib dr bahan yg halal kalau sampai d masukkan zat haram bs g diterima ibadah kita,https://x.com/undefined/status/1853772173787484225
,iya nih dulu aja kan juga bisa yakin halal haram tanpa harus ada sertifikasi sekarang jadi formalitas aja kayaknya,https://x.com/undefined/status/1853751201583513956
,ini tanggal 1 november masih ada kalimat yang nggak halal gimana ya boleh banget beredar asal dikasih label nonhalal tidak halal pokone harus ada label label 100 haram contohnya,https://x.com/undefined/status/1853692256794149342
,sertifikasi produk halal 1 ada produk yang halal untuk dijual dan halal juga untuk dimakan 2 ada produk yang halal untuk dijual tapi haram untuk dimakan 3 ada produk yang haram untuk dijual juga haram untuk dimakan untuk melindungi konsumen,https://x.com/undefined/status/1853646500053782788
,iya d negara non muslim aja ada sertifikasi halal mestinya d indonesie yg mayoritas muslim harus nya ada sertifikasi haram,https://x.com/undefined/status/1853367201153073558
,apa fungsi dan manfaatnya sertifikasi halal untuk racun nyamuk serangga mungkinkan ada bahan dari babi sehingga bila di spray kan dan terhirup manusia menjadi konteks dasar haram nya ada bau bau botol sih,https://x.com/undefined/status/1853357982970773979
,halal buat yg bikin sertifikasi nya juga pejabat baru yg ngurusin halal haram,https://x.com/undefined/status/1853270615605866782
,positif thinking aja sapa tao si kampret ini berharap uang haram nya menjadi halal tanpa melalui sertifikasi halal dan berharap mendapatkan berkah dari para korban judi online serta bandarnya semoga tanpa sepengetahuan menteri yg terdahulubiar bersih bersih baiklin,https://x.com/undefined/status/1853219199008817322
,onemed gak usah repot dg sertifikasi alkohol nih produk alkohol 95 nya sudah dpt sertipikat halal lek jare agomo halal haram iku urusan panganan amp ombenombenan sing oleh diuntal lan diglogok sing halal thok dipersilaken,https://x.com/undefined/status/1852985158611411015
,halalharam seharusnya cukup ormas hanya di era jokowi diminta oleh negara akibatnya jadi kacau ikadin idi peradi dll itu ormas yg melakukan sertifikasi profesi masing2 anggota yg tdk mengikuti sertifikasi dan kemudian buka praktek maka praktekbya ilegal dan mrpk pidana,https://x.com/undefined/status/1852674594853077266
,sy mencontohkan tentang standart semudah mungkin agar anda mudah mencernanya masalahnya bukan rasa tp standart bs standart rasa standart halalharam standart mutu dll sertifikasi wrg padang adlh usaha agar wrg yg ada memiliki standart yaitu rasa khas padang cocokologi,https://x.com/undefined/status/1852662755331039558
,adalah lembaga sertifikasi halal dan haram nya kkn kalo model kaya gini bisa dapat sertifikasi halal dari maka akan dilanjutkan atau diaplikasikan oleh semua aparatur negara cara terbaik membubarkan memang dengan menghancurkan kredibilitasnya dari dalam,https://x.com/undefined/status/1852558778337816606
,looh baru tau sertifikasi halal barang jasa jadi halal haram itu bukan masalah yg di makan aja tapi dari cara pembuatan dan bahan bahannya wong ada sepatu skin pig aja ga boleh dibeli dan dipakai ama yg muslim,https://x.com/undefined/status/1852558394743488649
,sebenarnya kalo mau imbang dan gamau protes lebih baik sertifikasi halal dibarengi dengan sertifikasi haram sama juga halnya dengan sertifikasi keaslian sebuah produkbrand harus ada sertifikasi tidak asli win win solution,https://x.com/undefined/status/1852350150867665290
,setuju sih rm padang yg sesuai std dikasih stiker tapi yg gak masuk spec gak perlu diobrak abrik juga sama kayak sertifikasi halal aja yang gak punya logo halal kan belum tentu haram,https://x.com/undefined/status/1852332915897901070
,adanya sertifikasi haram ya,https://x.com/undefined/status/1851965397534441906
,menurut kalian ini ada korelasi nya gak sih menjelang pemilihan mentri tiba muncul isu produk haram yg mendapat sertifikasi halal dan isu tersebut hilang setelah haikal hasan di tunjuk sebagai kepala lembaga sertifikasi halal,https://x.com/undefined/status/1851807730455199983
,indonesia mayoritas islam buat apa sertifikasi halal harusnya sertifikasi haram agar tau yang dihindari misalnya orang jualan soto ayam sudah pasti yang sembelih ayam baca bismillah masak perlu sertifikat wong yang sembelih pasti muslim,https://x.com/undefined/status/1851641673824243783
,berit di jadi ken sertifikasi halal kalau mau jiga sertifikasi haram,https://x.com/undefined/status/1851236854835921080
,pak urusan halal haram itu termasuk vital kok diserahkan ke orang yang sudah banyak tau sepak terjang nya diminta klarifikasi saja ogah ini pejabat macam apa dikritik mahfud md soal sertifikasi halal haikal hassan ogah klarifikasi,https://x.com/undefined/status/1851231525813334244
,mahfud md menilai aturan soal sertifikasi halal membuat beragama di indonesia akan lebih terasa sulit karena tak semua yang haram dimakan itu tidak boleh diniagakan mending haikal di copot aja pak bikin riweuh,https://x.com/undefined/status/1851228121632227391
,agama di indonesia banyakhalal bagi agama yg satu haram bagi agama lainnyasertifikasi halal ini pemicu perpecahan bangsa,https://x.com/undefined/status/1851199640244490460
,kalau udah dapat sertifikasi tapi ngambilnya nyolong atau kagak bayar tetep aja jadi haram harusnya kasih tau aja ini barang a haram mengandung babi misalnya kalau ada iman pasti akan menjauhi dengan sendirinya kalau dilanggar ya itu urusan dia ama tuhan,https://x.com/undefined/status/1851199423201923474
,label produk haram lebih efektif ketimbang wajib sertifikasi halal,https://x.com/undefined/status/1851171971683533180
,masalah sertifikasi produk halal adalah tentu utk produk yg memang halal tentu yg di luar itu malah dilarang menggudakan label halal fungsi label halal adalah utk memberitahu muslim bahwa produk itu halal label halal bukan utk menghalalkan produk haram,https://x.com/undefined/status/1851171269888393345
,jadi kita tidak bertanya mana bukti dan dalil bahwa vaksin itu halal sumber copyright 2024,https://x.com/undefined/status/1851133777487216759
,ya krn mayoritas jd lbh byk jumlah sertifikasi halal ketimbang haram taulah duitnya jd lbh byk kan wkwkwk,https://x.com/undefined/status/1850413825700647040
,dari dulu gw pikir indonesia mah lebih butuh sertifikasi haram dibanding halal simple aja yg emang produknya gak halal bisa kena hukuman kl ketauan tp kl emang dh sertifikasi haram ya gpp skrang ampe kacamata di sertifikasi halal gimmick marketing aja,https://x.com/undefined/status/1850404068465988076
,pak didu tau ga mentri baru yg baru menjabat yg 1 minta anggaran ditaikan yg 1 acara keluarga pakai kop surat negara yg 1 keliru dan salah menyampaikan devinisi sertifikasi halal haram,https://x.com/undefined/status/1850401824039489704
,jaka sembung lu ngomongin halal haram kesimpulannya gue ga peduli sesama klo oknum korupsi di instansi manapun bisa ada saat ketauan ya ditindak lu udah ga ngerti halal haram nge judge badan sertifikasi halal korup,https://x.com/undefined/status/1850368256458326265
,gue ga pnh beli makanan di pinggir jalan kec gue kenal dia muslim yg ngerti halal haram gue sgt hati2 soal makanan lu ga ngerti halal haram makanya lu blg sertifikasi haram kegoblokan lu soal halal haram makin keliatan sesuatu yg ga ada sertifikat haram tidak otomatis halal,https://x.com/undefined/status/1850366329225932977
,lu ga ngerti soal halal haram jadi mending diem aja walau di indonesia mayoritas ktp islam tapi banyak yg ga ngerti halal haram makanya perlu sertifikasi yg haram ga cuman babi ayam halal tapi klo sembelihnya ga menyebut nama alloh jadi haram,https://x.com/undefined/status/1850363952095732116
,coba tanya beliau kalo menjilat ludah sendiri itu haram ga atau perlu di sertifikasi halal juga ga ucapannya,https://x.com/undefined/status/1850355619913781590
,mewajibkan sertifikasi halal tapi caranya dia haram,https://x.com/undefined/status/1850342278944182598
,scr insentif bisnis ide sertifikasi haram itu gk make sense ngapain produsen indo membatasi reach marketnya dgn ngaku produk mereka haram kalau gk ada sertifikasi halal justru sertifikasi halal melindungi konsumen kritik deh mslh birokrasi tapi ide sertifikasi haram konyol,https://x.com/undefined/status/1850338109579493550
,tiren artinya bangkai itu haram zatzat aditif yg berbahaya seperti formalinboraxmercury serahkan saja penyelidikan pada polisi sertifikasi halal mui sudah ada sejak 1989 hingga kini tak efektif melindungi konsumen muslim dari bahan adiktif berbahaya,https://x.com/undefined/status/1850328291863142775
,miras perlu di sertifikasi halal kah biar bisa di jual belikan kenapa gak melabeli yg haram saja ya pa,https://x.com/undefined/status/1850321152994152476
,begini yang haram itu biasanya mahal2 di kenakan biaya sertifikasi yang mahal juga enggak masalah karena segmen pasarnya kelas atas yang halal itu biasanya murah spt gorengan mie ayam bakso dll pelaku usaha amp konsumen menengah bawah mereka yang akan membayar biaya sertifikasi,https://x.com/undefined/status/1850318977131757906
,stiker atau tanda pork ini lebih simpel sederhana ketimbang sertifikasi halal setiap penjual makanan yang mengandung babi atau lemak babi wajib menempelkan stiker tak perlu institusi otoritas depag tak perlu biaya tinggi semua makanan halal kecuali yang haram,https://x.com/undefined/status/1850314511330529649
,untuk urusan daging babi saya menghormati kalian walaupun aku gak makan tapi faham laaaa justru imho tanda harampork itu lebih penting tak perlu institusisertifikasi khusus apalagi dibiayai pemerintah cukup dengan stiker atau tanda boleh dibuat sendiri,https://x.com/undefined/status/1850313761762287843
,cuan cuan cuan halal dan haram adalah tentang jual beli sertifikasi pada akhirnya,https://x.com/undefined/status/1850305611285856389
,wajib sertifikasi halal yang disuarakan oleh mulut seorang penjilat haram apa halal oposisi sampai mati tp klo dapet jabatan semua dijilat sampai licin,https://x.com/undefined/status/1850193940378714278
,bukannya kalau semua harus sertifikasi halal berarti yg haram tidak boleh diperdagangkan jadinya,https://x.com/undefined/status/1850181019711975428
,1 sertifikasi haram lebih tepat amp bisa efektif implementasinya plus efisien biayanya tetapi cakupannya kecil kurang menghasilkan fulus 2 sertifikasi halal cakupannya luas sekali bayangkan fulus yg bakal dipanen 3 masih kurang jelas mengapa butir2 yg dipilih,https://x.com/undefined/status/1850169282216530333
,bener cak nun yg perlu di sertifikasi itu yg haram bukan yg halal krn yg haram di indo itu jenisy sedikit kalo smua yg sdh jelas halal harus disertifikasi halal itu namany pengangguran cari kerjaan,https://x.com/undefined/status/1850157658101403920
,yth bapak mohon sertifikasi halal diganti dengan sertifikasi haram agar tak membebani produsen maupun konsumen,https://x.com/undefined/status/1850150739928310184
,yg harus di sertifikasi itu makanan yg haram karena makanan mayoritas negri ini halal karena selama ini sdh salah kaprah amp kebodohan yg di biarkan produk masakan atau makanan mayoritas muslim yg sdh jelas halal ko di sertifikasi bukanya itu kedungu,https://x.com/undefined/status/1850145526672683350
,maksudnya gimana ya prof khan tujuannya utk penjaminan bg wn yg beragama islam perlu ada kejelasan statusnya produk2 yg beredar di msy apakah sertifikasi halal tdk perlu atau diserahkan ke msyrkt sj sesuai dg tafsir halalharam yg dipahami oleh msyrkt,https://x.com/undefined/status/1850144687908388960
,batubara nikel emas pasir dll hasil tambang dan sumber daya alam lainnya harus sertifikasi halal juga dong proses perijinan dan jual beli sama investor selama ini banyak haram nya kan agak laen be,https://x.com/undefined/status/1850144379622854900
,kalau di negara mayoritas kafir boleh lah pake sertifikasi halal laaa ini negara mayoritas muslim lebih efektif yang perlu disertifikasi itu yang haram,https://x.com/undefined/status/1850129167104582044
,bukan sertifikasi halal yang diperlukan tapi sertifikasi haram lebih gampang lebih hemat,https://x.com/undefined/status/1850128033174466610
,cukup makanan sama minuman saja yg harus di sertifikasi halal dan bukan berarti yg tidak punya sertifikasi itu haram kita nih negara mayoritas muslim juga loh,https://x.com/undefined/status/1850107030977364052
